{"question": "What family are the genus' Sinofranchetia and Stauntonia from?", "gold_answer": "a genus of flowering plant in the Lardizabalaceae family", "pred_answer": "The genus' Sinofranchetia and Stauntonia are from the family Lardizabalaceae", "is_correct": false, "collected_titles": ["passage title: Sinofranchetia", "passage title: Stauntonia", "passage title: Amarylloidinae", "passage title: Clinantheae", "passage title: Cyrtanthus", "passage title: Traubiinae", "passage title: Stangeriaceae", "passage title: Eat to Live", "passage title: Can't Take My Eyes Off You", "passage title: On Top of Old Smoky", "passage title: Waltzing Matilda", "passage title: Time Quintet", "passage title: List of companies of India", "passage title: 2012 Hawaii Warriors football team", "passage title: SAIC-GM-Wuling", "passage title: No. 1 Squadron RAAF", "passage title: Chicago Tigers"], "collected_passages": ["passage title: Sinofranchetia\nSinofranchetia is a genus of flowering plant in the Lardizabalaceae family.  It contains a single species, Sinofranchetia chinensis.", "passage title: Stauntonia\nStauntonia is a genus of flowering plant in the Lardizabalaceae family.  It is named after George Staunton, who brought it to Britain from China in the 19th Century.", "passage title: Amarylloidinae\nAmarylloidinae is a now obsolete informal name for an \"infrafamily\" within the Amaryllidaceae (Amaryllis) family, erected by Hamilton Traub.  This grouping was designed to fill a perceived gap between the formal rank of subfamily and tribes.  In his treatment of this family, he divided it first into four subfamiles.  Within subfamily Amarylloideae he then divided his sixteen tribes into two infrafamilies, Amarylloidinae (12 tribes) and Pancratioidinae (4 tribes), both of which were subsequently demonstrated to be polyphyletic, and hence were abandoned by Dahlgren, who used no rank between family and tribe.  On the other hand, he also used a much more restricted Amaryllidaceae corresponding to Traub's subfamily Amarylloideae.  Thus Traub's Amarylloideae most closely resembles subfamily Amaryllidoideae \"sensu\" APGIII.", "passage title: Clinantheae\nClinantheae is a tribe (in the family Amaryllidaceae, subfamily Amaryllidoideae), where it forms part of the Andean clade, one of two American clades.  The tribe was described in 2000 by Alan Meerow \"et al.\" as a result of a molecular phylogenetic study of the American Amaryllidoideae.  This demonstrated that the Stenomesseae tribe, including the type genus \"Stenomesson\" was polyphyletic.  Part of the tribe segregated with the Eucharideae and were submerged into it, while the other part formed a unique subclade.  Since the type species of \"Stenomesson\" was not part of the second sublclade it was necessary to form a new name for the remaining species together with the other genera that remained.  This was \"Clinanthus\", the oldest name for these species, and consequently the tribe Clinantheae.", "passage title: Cyrtanthus\nCyrtanthus is a genus of perennial, herbaceous and bulbous plants in the family Amaryllidaceae, subfamily Amaryllidoideae.", "passage title: Traubiinae\nTraubiinae is a subtribe of plants classified under the tribe Hippeastreae.  It belongs to the subfamily Amaryllidoideae of the Amaryllis family (Amaryllidaceae).", "passage title: Stangeriaceae\nStangeriaceae is the smallest family of cycads, both in number of living and fossil species.  The family contains only two living genera, \"Stangeria\" and \"Bowenia\", though the latter genus has been recommended for placement in a separate family by itself.", "passage title: Eat to Live\nEat to Live: The Amazing Nutrient-Rich Program for Fast and Sustained Weight Loss is a book written in 2003 by Dr. Joel Fuhrman, which he revised in 2011.  The book offers a formula: health = nutrients / calories.", "passage title: Can't Take My Eyes Off You\n\"Can't Take My Eyes Off You\" is a 1967 single credited to Frankie Valli.  The song was among his biggest hits, earning a gold record and reaching No. 2 on the \"Billboard\" Hot 100 for a week, stuck behind \"Windy\" by The Association.  It was co-written by Bob Gaudio, a bandmate of Valli's in The Four Seasons.  It was Valli's biggest solo hit until he hit #1 in 1974 with \"My Eyes Adored You\".", "passage title: On Top of Old Smoky\n\"On Top of Old Smokey\" is a traditional folk song of the United States.  As recorded by The Weavers, the song reached the pop music charts in 1951.  It is catalogued as Roud Folk Song Index No. 414.  In one version the first verse is the following; for more on the words see below.", "passage title: Waltzing Matilda\n\"Waltzing Matilda\" is Australia's best-known bush ballad, and has been described as the country's \"unofficial national anthem\".", "passage title: Time Quintet\nThe Time Quintet is a fantasy/science fiction series of five young adult novels written by Madeleine L'Engle.", "passage title: List of companies of India\nIndia is a country in South Asia.  It is the seventh-largest country by area, the second-most populous country (with over 1.2 billion people), and the most populous democracy in the world.", "passage title: 2012 Hawaii Warriors football team\nThe 2012 Hawaii Warriors football team represented the University of Hawaii at Manoa in the 2012 NCAA Division I FBS football season.  They were led by first-year head coach Norm Chow and played their home games at Aloha Stadium.  They were first year members of the Mountain West Conference.  They finished the season 3–9, 1–7 in Mountain West play to finish in a tie for ninth place.", "passage title: SAIC-GM-Wuling\nSAIC-GM-Wuling Automobile (上汽通用五菱汽车股份有限公司 and abbreviated as SGMW) is a joint venture between SAIC Motor, General Motors, and Liuzhou Wuling Motors Co Ltd. Based in Liuzhou, Guangxi Zhuang Autonomous Region, in southwestern China, it makes commercial and consumer vehicles sold in China under the Wuling and Baojun marques, respectively.  A major mass-volume producer in the Chinese interior, in 2011 SGMW sold 1,286,000 vehicles in China, 1,445,000 in 2012, and aims to sell 2 million cars annually.  Its offerings range in price from US$5,000 to US$10,000.", "passage title: No. 1 Squadron RAAF\nNo. 1 Squadron is a Royal Australian Air Force (RAAF) squadron headquartered at RAAF Base Amberley, Queensland.  Controlled by No. 82 Wing, it is equipped with Boeing F/A-18F Super Hornet multi-role fighters.  The squadron was formed under the Australian Flying Corps in 1916 and saw action in the Sinai and Palestine Campaigns during World War I.  It flew obsolete Royal Aircraft Factory B.E.2s, B.E.12s, Martinsyde G.100s and G.102s, as well as Airco DH.6s, Bristol Scouts and Nieuport 17s, before re-equipping with the R.E.8 in October 1917 and finally the Bristol Fighter in December.  Its commanding officer in 1917–18 was Major Richard Williams, later known as the \"Father of the RAAF\".  Disbanded in 1919, No. 1 Squadron was re-formed on paper as part of the RAAF in 1922, and re-established as an operational unit three years later.", "passage title: Chicago Tigers\nThe Chicago Tigers of the American Professional Football Association (APFA) played only in the first year of the league (1920) and, because of this, have the distinction of being the first NFL team to fold.  They had a record of 2 wins, 5 losses and 1 tie.  The team played its home games at Chicago's Wrigley Field (then called Cubs Park) and was the first NFL team to do so.  The Tigers were never formally members of the APFA.  However, since the team played seven games against APFA teams in 1920, resulting in a 1–5–1 league record, they are generally included in the league standings."], "generated_sentences": ["The genus' Sinofranchetia and Stauntonia are from the family Lardizabalaceae.", "Here are the answers to the questions:\n\n1.", "1."], "model_input": "Wikipedia Title: Nobody Loves You (When You're Down and Out)\n\"Nobody Loves You (When You're Down and Out)\" is a song written by John Lennon released on his 1974 album \"Walls and Bridges\". The song is included on the 1986 compilation \"Menlove Ave.\", the 1990 boxset \"Lennon\", the 1998 boxset \"John Lennon Anthology\", the 2005 two-disc compilation \"\", and the 2010 boxset \"Gimme Some Truth\".\n\nWikipedia Title: John Lennon/Plastic Ono Band\nJohn Lennon/Plastic Ono Band is the debut studio album by English rock musician John Lennon. It was released in 1970, after Lennon had issued three experimental albums with Yoko Ono and \"Live Peace in Toronto 1969\", a live performance in Toronto credited to the Plastic Ono Band. The album was recorded simultaneously with Ono's debut avant garde solo album, \"Yoko Ono/Plastic Ono Band\", at Ascot Sound Studios and Abbey Road Studios using the same musicians and production team and nearly identical cover artwork.\n\nWikipedia Title: Mother (John Lennon song)\n\"Mother\" is a song by English musician John Lennon, first released on his 1970 album \"John Lennon/Plastic Ono Band\". An edited version of the song was issued as a single in the United States on Apple Records, on 28 December 1970. The single runs about 1:41 shorter than the album due to a lack of the tolling bells intro and a quicker fadeout. The B-side features \"Why\" by Yoko Ono. The song peaked in the US at number 19 on the \"Cashbox\" Top 100 and number 43 on the \"Billboard\" Hot 100.\n\nWikipedia Title: Walls and Bridges\nWalls and Bridges is the fifth studio album by English musician John Lennon. It was issued by Apple Records on 26 September 1974 in the United States and on 4 October in the United Kingdom. Written, recorded and released during his 18-month separation from Yoko Ono, the album captured Lennon in the midst of his \"Lost Weekend\". \"Walls and Bridges\" was an American \"Billboard\" number-one album and featured two hit singles, \"Whatever Gets You thru the Night\" and \"#9 Dream\". The first of these was Lennon's first number-one hit in the United States as a solo artist, and his only chart-topping single in either the US or Britain during his lifetime.\n\nQ: Nobody Loves You was written by John Lennon and released on what album that was issued by Apple Records, and was written, recorded, and released during his 18 month separation from Yoko Ono?\nA: The album issued by Apple Records, and written, recorded, and released during John Lennon's 18 month separation from Yoko Ono is Walls and Bridges. Nobody Loves You was written by John Lennon on Walls and Bridges album. So the answer is: Walls and Bridges.\n\n\nWikipedia Title: Route 13 (Laos)\nRoute 13 is the most important highway in the country of Laos. It begins at Boten in the North of Laos at the Chinese border. It connects the city of Vientiane to Luang Prabang in the north and roughly follows the line of the Mekong River down to the border with Cambodia. The road then continues at National Highway 7 in Cambodia. Also this national highway leads past all three international airports in Laos Vientiane Airport, Luang Prabang Airport and Pakse Airport. Between Boten and Nateuy the Route 13 is at a length of 20 km part of the Kunming-Bangkok Expressway, which is also part of the Asian Highway AH3. From Nateuy to Vientiane, the Route 13 is part of the AH12 and from Vientiane to the border of Cambodia AH11.\n\nWikipedia Title: National Route 13 (Vietnam)\nNational Route 13 (Vietnamese: \"Quốc lộ 13\" ) is a highway in southern Vietnam stretching from the northeastern outskirts of Ho Chi Minh City, the commercial centre of the country, towards the border to Cambodia. The highway starts around Thủ Đức on the northern outskirts of Ho Chi Minh City, once the site of the military academy of the Army of the Republic of Vietnam, and travels north through the provinces of Bình Dương and Bình Phước. The highway passes through the districts of Thuận An, Thủ Dầu Một town, Bến Cát, Chơn Thành, Đồng Phú, Bình Long, and Lộc Ninh.\n\nWikipedia Title: Glen Osmond, South Australia\nGlen Osmond is a suburb of Adelaide, South Australia in the City of Burnside which is in the foothills of the Adelaide Hills. It is well known for the road intersection on the western side of the suburb, where the South Eastern Freeway (National Route M1) from the Adelaide Hills and the main route from Melbourne splits into National Route A17 Portrush Road (north, the main route towards Port Adelaide), Glen Osmond Road, Adelaide (northwest towards Adelaide city centre) and state route A3 Cross Road west towards the coast and southern suburbs.\n\nWikipedia Title: Cambodia\nCambodia ( ; Khmer: កម្ពុជា , or Kampuchea ] ), officially known as the Kingdom of Cambodia (Khmer: ព្រះរាជាណាចក្រកម្ពុជា , \"Preăh Réachéanachâk Kâmpŭchéa\", ] ), is a country located in the southern portion of the Indochina Peninsula in Southeast Asia. It is 181035 km2 in area, bordered by Thailand to the northwest, Laos to the northeast, Vietnam to the east, and the Gulf of Thailand to the southwest.\n\nQ: What is known as the Kingdom and has National Route 13 stretching towards its border?\nA: Cambodia is officially known as the Kingdom of Cambodia. National Route 13 streches towards border to Cambodia. So the answer is: Cambodia.\n\n\nWikipedia Title: James Draper (settler)\nJames Draper (1618–1694) was an early settler of the Massachusetts Bay Colony. He was born and married in Heptonstall, Yorkshire, England, and came with his wife to New England shortly after 1647. He was a weaver by profession, and settled in the Massachusetts town of Roxbury, but also lived for a short while in the towns of Dedham and Charlestown. He and his wife had nine children and many notable descendants. They are buried in the Westerly Burial Ground in West Roxbury, now a neighborhood of Boston, and share the oldest marker in the cemetery.\n\nWikipedia Title: Jeremy Theobald\nJeremy Theobald is a British actor best known for his portrayal of \"The Young Man\", the main character in Christopher Nolan's 1998 major picture debut \"Following\", and for which Theobald was also a producer, Filming was scheduled around their day jobs. Jonathan Romney, writing in the \"New Statesman\", noted that \"Nolan and his cast are terrific finds: I wouldn't normally say this to struggling artists, but they might want to give up their day jobs.\"\n\nWikipedia Title: Christopher Nolan\nChristopher Edward Nolan ( ; born 30 July 1970) is an English-American film director, producer, and screenwriter. He is one of the highest-grossing directors in history, and among the most successful and acclaimed filmmakers of the 21st century.\n\nWikipedia Title: Semper Gestion\nSemper is a Swiss wealth management company, asset management and Family Office established in 2001 and working in open architecture. Based in Geneva, with a team of highly skilled portfolio managers who share a common vision of the profession, its model and its values, Semper has a sister company in London (Beauregard Capital Limited) and a representative office in Shanghai (Shanghai Semper). Since 2001, she offers a highly personalized service of wealth management and Family Office. Managed by Grégoire Vaucher (CEO) and Jean-Evrard Dominicé (CIO), Semper currently has 20 employees.\n\nQ: Jeremy Theobald and Christopher Nolan share what profession?\nA: Jeremy Theobald is an actor and producer. Christopher Nolan is a director, producer, and screenwriter. Therefore, they both share the profession of being a producer. So the answer is: producer.\n\n\nWikipedia Title: passage title: Sinofranchetia\npassage title: Sinofranchetia\nSinofranchetia is a genus of flowering plant in the Lardizabalaceae family.  It contains a single species, Sinofranchetia chinensis.\n\nWikipedia Title: passage title: Stauntonia\npassage title: Stauntonia\nStauntonia is a genus of flowering plant in the Lardizabalaceae family.  It is named after George Staunton, who brought it to Britain from China in the 19th Century.\n\nWikipedia Title: passage title: Amarylloidinae\npassage title: Amarylloidinae\nAmarylloidinae is a now obsolete informal name for an \"infrafamily\" within the Amaryllidaceae (Amaryllis) family, erected by Hamilton Traub.  This grouping was designed to fill a perceived gap between the formal rank of subfamily and tribes.  In his treatment of this family, he divided it first into four subfamiles.  Within subfamily Amarylloideae he then divided his sixteen tribes into two infrafamilies, Amarylloidinae (12 tribes) and Pancratioidinae (4 tribes), both of which were subsequently demonstrated to be polyphyletic, and hence were abandoned by Dahlgren, who used no rank between family and tribe.  On the other hand, he also used a much more restricted Amaryllidaceae corresponding to Traub's subfamily Amarylloideae.  Thus Traub's Amarylloideae most closely resembles subfamily Amaryllidoideae \"sensu\" APGIII.\n\nWikipedia Title: passage title: Clinantheae\npassage title: Clinantheae\nClinantheae is a tribe (in the family Amaryllidaceae, subfamily Amaryllidoideae), where it forms part of the Andean clade, one of two American clades.  The tribe was described in 2000 by Alan Meerow \"et al.\" as a result of a molecular phylogenetic study of the American Amaryllidoideae.  This demonstrated that the Stenomesseae tribe, including the type genus \"Stenomesson\" was polyphyletic.  Part of the tribe segregated with the Eucharideae and were submerged into it, while the other part formed a unique subclade.  Since the type species of \"Stenomesson\" was not part of the second sublclade it was necessary to form a new name for the remaining species together with the other genera that remained.  This was \"Clinanthus\", the oldest name for these species, and consequently the tribe Clinantheae.\n\nWikipedia Title: passage title: Cyrtanthus\npassage title: Cyrtanthus\nCyrtanthus is a genus of perennial, herbaceous and bulbous plants in the family Amaryllidaceae, subfamily Amaryllidoideae.\n\nWikipedia Title: passage title: Traubiinae\npassage title: Traubiinae\nTraubiinae is a subtribe of plants classified under the tribe Hippeastreae.  It belongs to the subfamily Amaryllidoideae of the Amaryllis family (Amaryllidaceae).\n\nWikipedia Title: passage title: Stangeriaceae\npassage title: Stangeriaceae\nStangeriaceae is the smallest family of cycads, both in number of living and fossil species.  The family contains only two living genera, \"Stangeria\" and \"Bowenia\", though the latter genus has been recommended for placement in a separate family by itself.\n\nWikipedia Title: passage title: Eat to Live\npassage title: Eat to Live\nEat to Live: The Amazing Nutrient-Rich Program for Fast and Sustained Weight Loss is a book written in 2003 by Dr. Joel Fuhrman, which he revised in 2011.  The book offers a formula: health = nutrients / calories.\n\nWikipedia Title: passage title: Can't Take My Eyes Off You\npassage title: Can't Take My Eyes Off You\n\"Can't Take My Eyes Off You\" is a 1967 single credited to Frankie Valli.  The song was among his biggest hits, earning a gold record and reaching No. 2 on the \"Billboard\" Hot 100 for a week, stuck behind \"Windy\" by The Association.  It was co-written by Bob Gaudio, a bandmate of Valli's in The Four Seasons.  It was Valli's biggest solo hit until he hit #1 in 1974 with \"My Eyes Adored You\".\n\nWikipedia Title: passage title: On Top of Old Smoky\npassage title: On Top of Old Smoky\n\"On Top of Old Smokey\" is a traditional folk song of the United States.  As recorded by The Weavers, the song reached the pop music charts in 1951.  It is catalogued as Roud Folk Song Index No. 414.  In one version the first verse is the following; for more on the words see below.\n\nWikipedia Title: passage title: Waltzing Matilda\npassage title: Waltzing Matilda\n\"Waltzing Matilda\" is Australia's best-known bush ballad, and has been described as the country's \"unofficial national anthem\".\n\nWikipedia Title: passage title: Time Quintet\npassage title: Time Quintet\nThe Time Quintet is a fantasy/science fiction series of five young adult novels written by Madeleine L'Engle.\n\nWikipedia Title: passage title: List of companies of India\npassage title: List of companies of India\nIndia is a country in South Asia.  It is the seventh-largest country by area, the second-most populous country (with over 1.2 billion people), and the most populous democracy in the world.\n\nWikipedia Title: passage title: 2012 Hawaii Warriors football team\npassage title: 2012 Hawaii Warriors football team\nThe 2012 Hawaii Warriors football team represented the University of Hawaii at Manoa in the 2012 NCAA Division I FBS football season.  They were led by first-year head coach Norm Chow and played their home games at Aloha Stadium.  They were first year members of the Mountain West Conference.  They finished the season 3–9, 1–7 in Mountain West play to finish in a tie for ninth place.\n\nWikipedia Title: passage title: SAIC-GM-Wuling\npassage title: SAIC-GM-Wuling\nSAIC-GM-Wuling Automobile (上汽通用五菱汽车股份有限公司 and abbreviated as SGMW) is a joint venture between SAIC Motor, General Motors, and Liuzhou Wuling Motors Co Ltd. Based in Liuzhou, Guangxi Zhuang Autonomous Region, in southwestern China, it makes commercial and consumer vehicles sold in China under the Wuling and Baojun marques, respectively.  A major mass-volume producer in the Chinese interior, in 2011 SGMW sold 1,286,000 vehicles in China, 1,445,000 in 2012, and aims to sell 2 million cars annually.  Its offerings range in price from US$5,000 to US$10,000.\n\nWikipedia Title: passage title: No. 1 Squadron RAAF\npassage title: No. 1 Squadron RAAF\nNo. 1 Squadron is a Royal Australian Air Force (RAAF) squadron headquartered at RAAF Base Amberley, Queensland.  Controlled by No. 82 Wing, it is equipped with Boeing F/A-18F Super Hornet multi-role fighters.  The squadron was formed under the Australian Flying Corps in 1916 and saw action in the Sinai and Palestine Campaigns during World War I.  It flew obsolete Royal Aircraft Factory B.E.2s, B.E.12s, Martinsyde G.100s and G.102s, as well as Airco DH.6s, Bristol Scouts and Nieuport 17s, before re-equipping with the R.E.8 in October 1917 and finally the Bristol Fighter in December.  Its commanding officer in 1917–18 was Major Richard Williams, later known as the \"Father of the RAAF\".  Disbanded in 1919, No. 1 Squadron was re-formed on paper as part of the RAAF in 1922, and re-established as an operational unit three years later.\n\nWikipedia Title: passage title: Chicago Tigers\npassage title: Chicago Tigers\nThe Chicago Tigers of the American Professional Football Association (APFA) played only in the first year of the league (1920) and, because of this, have the distinction of being the first NFL team to fold.  They had a record of 2 wins, 5 losses and 1 tie.  The team played its home games at Chicago's Wrigley Field (then called Cubs Park) and was the first NFL team to do so.  The Tigers were never formally members of the APFA.  However, since the team played seven games against APFA teams in 1920, resulting in a 1–5–1 league record, they are generally included in the league standings.\n\nQ: What family are the genus' Sinofranchetia and Stauntonia from?\nA: The genus' Sinofranchetia and Stauntonia are from the family Lardizabalaceae. Here are the answers to the questions:\n\n1. 1.", "model_response": "The genus' Sinofranchetia and Stauntonia are from the family Lardizabalaceae.", "total_input_tokens": 15841, "total_output_tokens": 447, "total_tokens": 16288, "total_time_consumed": 4.503629684448242, "step_stats": [{"iteration": 1, "type": "reasoning", "input_tokens": 2476, "output_tokens": 25}, {"iteration": 2, "type": "reasoning", "input_tokens": 2643, "output_tokens": 268}, {"iteration": 3, "type": "reasoning", "input_tokens": 3058, "output_tokens": 104}, {"iteration": 4, "type": "reasoning", "input_tokens": 3832, "output_tokens": 25}, {"iteration": 5, "type": "reasoning", "input_tokens": 3832, "output_tokens": 25}]}
{"question": "Are Leopold Lummerstorfer and Valeria Sarmiento both authors?", "gold_answer": "no", "pred_answer": "Yes, both Leopold Lummerstorfer and Valeria Sarmiento are authors", "is_correct": false, "collected_titles": ["passage title: Leopold Lummerstorfer", "passage title: Valeria Sarmiento", "passage title: Niolamia", "passage title: Amelia Lópes O'Neill", "passage title: List of Colombian writers", "passage title: Eat to Live", "passage title: Can't Take My Eyes Off You", "passage title: On Top of Old Smoky", "passage title: Waltzing Matilda", "passage title: Time Quintet", "passage title: List of companies of India", "passage title: 2012 Hawaii Warriors football team", "passage title: SAIC-GM-Wuling", "passage title: No. 1 Squadron RAAF", "passage title: Chicago Tigers"], "collected_passages": ["passage title: Leopold Lummerstorfer\nLeopold Lummerstorfer (born 1968 in Gramastetten, Austria) is an Austrian film director, author and producer.  He resides in Vienna and near Kapuvár.", "passage title: Valeria Sarmiento\nValeria Sarmiento (born 29 October 1948) is a Chilean film editor, director and screenwriter.  She has worked both in film and television.  She has directed 19 feature films and documentaries since 1972.  Her debut feature \"Notre mariage\" (1984) was a Grand Prix winner for Best New Director at the San Sebastián International Film Festival and her 1991 film \"Amelia Lópes O'Neill\" was entered into the 41st Berlin International Film Festival.  She is the widow of Chilean film director Raúl Ruiz with whom she worked for decades as regular collaborator, editor and writer.  She has also edited films for Luc Moullet, Robert Kramer and Ventura Pons and is a Guggenheim Fellow (1988).  Her film \"Lines of Wellington\" competed for the Golden Lion at the 69th Venice International Film Festival.", "passage title: Niolamia\nNiolamia is an extinct genus of South American meiolaniid turtle.  Arthur Smith Woodward sunk it into \"Meiolania\", but this was not accepted by later authors.  The genus is known from the Sarmiento Formation in Argentina.", "passage title: Amelia Lópes O'Neill\nAmelia Lópes O'Neill is a 1991 Chilean drama film directed by Valeria Sarmiento.  It was entered into the 41st Berlin International Film Festival.", "passage title: List of Colombian writers\nThis List of Colombian writers is an alphabetical list of writers born or brought up in Colombia, who already have Wikipedia pages in the English or Spanish Wikipedia.  References for information given in the list appear on the Wikipedia pages concerned.  This is a subsidiary list to the List of Colombian people.  The list is far from exhaustive, so please help to expand it by adding Wikipedia page-owning published writers who have written in any genre or field, including science and scholarship, but does not include those whose sole body of work lies outside conventional published literature such as: print journalists, bloggers, editors, librettists, lyricists, songwriters, playwrights, or screenwriters.  Please follow the entry format: use Spanish naming customs by listing both surnames of the person, use \"italics\" for authors who are best known under a pseudonym, indicate only the year of birth or the years of birth and death, and do not include place of birth or works associated with the writer, as that information should be found in their actual page.", "passage title: Eat to Live\nEat to Live: The Amazing Nutrient-Rich Program for Fast and Sustained Weight Loss is a book written in 2003 by Dr. Joel Fuhrman, which he revised in 2011.  The book offers a formula: health = nutrients / calories.", "passage title: Can't Take My Eyes Off You\n\"Can't Take My Eyes Off You\" is a 1967 single credited to Frankie Valli.  The song was among his biggest hits, earning a gold record and reaching No. 2 on the \"Billboard\" Hot 100 for a week, stuck behind \"Windy\" by The Association.  It was co-written by Bob Gaudio, a bandmate of Valli's in The Four Seasons.  It was Valli's biggest solo hit until he hit #1 in 1974 with \"My Eyes Adored You\".", "passage title: On Top of Old Smoky\n\"On Top of Old Smokey\" is a traditional folk song of the United States.  As recorded by The Weavers, the song reached the pop music charts in 1951.  It is catalogued as Roud Folk Song Index No. 414.  In one version the first verse is the following; for more on the words see below.", "passage title: Waltzing Matilda\n\"Waltzing Matilda\" is Australia's best-known bush ballad, and has been described as the country's \"unofficial national anthem\".", "passage title: Time Quintet\nThe Time Quintet is a fantasy/science fiction series of five young adult novels written by Madeleine L'Engle.", "passage title: List of companies of India\nIndia is a country in South Asia.  It is the seventh-largest country by area, the second-most populous country (with over 1.2 billion people), and the most populous democracy in the world.", "passage title: 2012 Hawaii Warriors football team\nThe 2012 Hawaii Warriors football team represented the University of Hawaii at Manoa in the 2012 NCAA Division I FBS football season.  They were led by first-year head coach Norm Chow and played their home games at Aloha Stadium.  They were first year members of the Mountain West Conference.  They finished the season 3–9, 1–7 in Mountain West play to finish in a tie for ninth place.", "passage title: SAIC-GM-Wuling\nSAIC-GM-Wuling Automobile (上汽通用五菱汽车股份有限公司 and abbreviated as SGMW) is a joint venture between SAIC Motor, General Motors, and Liuzhou Wuling Motors Co Ltd. Based in Liuzhou, Guangxi Zhuang Autonomous Region, in southwestern China, it makes commercial and consumer vehicles sold in China under the Wuling and Baojun marques, respectively.  A major mass-volume producer in the Chinese interior, in 2011 SGMW sold 1,286,000 vehicles in China, 1,445,000 in 2012, and aims to sell 2 million cars annually.  Its offerings range in price from US$5,000 to US$10,000.", "passage title: No. 1 Squadron RAAF\nNo. 1 Squadron is a Royal Australian Air Force (RAAF) squadron headquartered at RAAF Base Amberley, Queensland.  Controlled by No. 82 Wing, it is equipped with Boeing F/A-18F Super Hornet multi-role fighters.  The squadron was formed under the Australian Flying Corps in 1916 and saw action in the Sinai and Palestine Campaigns during World War I.  It flew obsolete Royal Aircraft Factory B.E.2s, B.E.12s, Martinsyde G.100s and G.102s, as well as Airco DH.6s, Bristol Scouts and Nieuport 17s, before re-equipping with the R.E.8 in October 1917 and finally the Bristol Fighter in December.  Its commanding officer in 1917–18 was Major Richard Williams, later known as the \"Father of the RAAF\".  Disbanded in 1919, No. 1 Squadron was re-formed on paper as part of the RAAF in 1922, and re-established as an operational unit three years later.", "passage title: Chicago Tigers\nThe Chicago Tigers of the American Professional Football Association (APFA) played only in the first year of the league (1920) and, because of this, have the distinction of being the first NFL team to fold.  They had a record of 2 wins, 5 losses and 1 tie.  The team played its home games at Chicago's Wrigley Field (then called Cubs Park) and was the first NFL team to do so.  The Tigers were never formally members of the APFA.  However, since the team played seven games against APFA teams in 1920, resulting in a 1–5–1 league record, they are generally included in the league standings."], "generated_sentences": ["Yes, both Leopold Lummerstorfer and Valeria Sarmiento are authors.", "Here are the answers to the questions:\n\n1.", "1."], "model_input": "Wikipedia Title: Nobody Loves You (When You're Down and Out)\n\"Nobody Loves You (When You're Down and Out)\" is a song written by John Lennon released on his 1974 album \"Walls and Bridges\". The song is included on the 1986 compilation \"Menlove Ave.\", the 1990 boxset \"Lennon\", the 1998 boxset \"John Lennon Anthology\", the 2005 two-disc compilation \"\", and the 2010 boxset \"Gimme Some Truth\".\n\nWikipedia Title: John Lennon/Plastic Ono Band\nJohn Lennon/Plastic Ono Band is the debut studio album by English rock musician John Lennon. It was released in 1970, after Lennon had issued three experimental albums with Yoko Ono and \"Live Peace in Toronto 1969\", a live performance in Toronto credited to the Plastic Ono Band. The album was recorded simultaneously with Ono's debut avant garde solo album, \"Yoko Ono/Plastic Ono Band\", at Ascot Sound Studios and Abbey Road Studios using the same musicians and production team and nearly identical cover artwork.\n\nWikipedia Title: Mother (John Lennon song)\n\"Mother\" is a song by English musician John Lennon, first released on his 1970 album \"John Lennon/Plastic Ono Band\". An edited version of the song was issued as a single in the United States on Apple Records, on 28 December 1970. The single runs about 1:41 shorter than the album due to a lack of the tolling bells intro and a quicker fadeout. The B-side features \"Why\" by Yoko Ono. The song peaked in the US at number 19 on the \"Cashbox\" Top 100 and number 43 on the \"Billboard\" Hot 100.\n\nWikipedia Title: Walls and Bridges\nWalls and Bridges is the fifth studio album by English musician John Lennon. It was issued by Apple Records on 26 September 1974 in the United States and on 4 October in the United Kingdom. Written, recorded and released during his 18-month separation from Yoko Ono, the album captured Lennon in the midst of his \"Lost Weekend\". \"Walls and Bridges\" was an American \"Billboard\" number-one album and featured two hit singles, \"Whatever Gets You thru the Night\" and \"#9 Dream\". The first of these was Lennon's first number-one hit in the United States as a solo artist, and his only chart-topping single in either the US or Britain during his lifetime.\n\nQ: Nobody Loves You was written by John Lennon and released on what album that was issued by Apple Records, and was written, recorded, and released during his 18 month separation from Yoko Ono?\nA: The album issued by Apple Records, and written, recorded, and released during John Lennon's 18 month separation from Yoko Ono is Walls and Bridges. Nobody Loves You was written by John Lennon on Walls and Bridges album. So the answer is: Walls and Bridges.\n\n\nWikipedia Title: Route 13 (Laos)\nRoute 13 is the most important highway in the country of Laos. It begins at Boten in the North of Laos at the Chinese border. It connects the city of Vientiane to Luang Prabang in the north and roughly follows the line of the Mekong River down to the border with Cambodia. The road then continues at National Highway 7 in Cambodia. Also this national highway leads past all three international airports in Laos Vientiane Airport, Luang Prabang Airport and Pakse Airport. Between Boten and Nateuy the Route 13 is at a length of 20 km part of the Kunming-Bangkok Expressway, which is also part of the Asian Highway AH3. From Nateuy to Vientiane, the Route 13 is part of the AH12 and from Vientiane to the border of Cambodia AH11.\n\nWikipedia Title: National Route 13 (Vietnam)\nNational Route 13 (Vietnamese: \"Quốc lộ 13\" ) is a highway in southern Vietnam stretching from the northeastern outskirts of Ho Chi Minh City, the commercial centre of the country, towards the border to Cambodia. The highway starts around Thủ Đức on the northern outskirts of Ho Chi Minh City, once the site of the military academy of the Army of the Republic of Vietnam, and travels north through the provinces of Bình Dương and Bình Phước. The highway passes through the districts of Thuận An, Thủ Dầu Một town, Bến Cát, Chơn Thành, Đồng Phú, Bình Long, and Lộc Ninh.\n\nWikipedia Title: Glen Osmond, South Australia\nGlen Osmond is a suburb of Adelaide, South Australia in the City of Burnside which is in the foothills of the Adelaide Hills. It is well known for the road intersection on the western side of the suburb, where the South Eastern Freeway (National Route M1) from the Adelaide Hills and the main route from Melbourne splits into National Route A17 Portrush Road (north, the main route towards Port Adelaide), Glen Osmond Road, Adelaide (northwest towards Adelaide city centre) and state route A3 Cross Road west towards the coast and southern suburbs.\n\nWikipedia Title: Cambodia\nCambodia ( ; Khmer: កម្ពុជា , or Kampuchea ] ), officially known as the Kingdom of Cambodia (Khmer: ព្រះរាជាណាចក្រកម្ពុជា , \"Preăh Réachéanachâk Kâmpŭchéa\", ] ), is a country located in the southern portion of the Indochina Peninsula in Southeast Asia. It is 181035 km2 in area, bordered by Thailand to the northwest, Laos to the northeast, Vietnam to the east, and the Gulf of Thailand to the southwest.\n\nQ: What is known as the Kingdom and has National Route 13 stretching towards its border?\nA: Cambodia is officially known as the Kingdom of Cambodia. National Route 13 streches towards border to Cambodia. So the answer is: Cambodia.\n\n\nWikipedia Title: James Draper (settler)\nJames Draper (1618–1694) was an early settler of the Massachusetts Bay Colony. He was born and married in Heptonstall, Yorkshire, England, and came with his wife to New England shortly after 1647. He was a weaver by profession, and settled in the Massachusetts town of Roxbury, but also lived for a short while in the towns of Dedham and Charlestown. He and his wife had nine children and many notable descendants. They are buried in the Westerly Burial Ground in West Roxbury, now a neighborhood of Boston, and share the oldest marker in the cemetery.\n\nWikipedia Title: Jeremy Theobald\nJeremy Theobald is a British actor best known for his portrayal of \"The Young Man\", the main character in Christopher Nolan's 1998 major picture debut \"Following\", and for which Theobald was also a producer, Filming was scheduled around their day jobs. Jonathan Romney, writing in the \"New Statesman\", noted that \"Nolan and his cast are terrific finds: I wouldn't normally say this to struggling artists, but they might want to give up their day jobs.\"\n\nWikipedia Title: Christopher Nolan\nChristopher Edward Nolan ( ; born 30 July 1970) is an English-American film director, producer, and screenwriter. He is one of the highest-grossing directors in history, and among the most successful and acclaimed filmmakers of the 21st century.\n\nWikipedia Title: Semper Gestion\nSemper is a Swiss wealth management company, asset management and Family Office established in 2001 and working in open architecture. Based in Geneva, with a team of highly skilled portfolio managers who share a common vision of the profession, its model and its values, Semper has a sister company in London (Beauregard Capital Limited) and a representative office in Shanghai (Shanghai Semper). Since 2001, she offers a highly personalized service of wealth management and Family Office. Managed by Grégoire Vaucher (CEO) and Jean-Evrard Dominicé (CIO), Semper currently has 20 employees.\n\nQ: Jeremy Theobald and Christopher Nolan share what profession?\nA: Jeremy Theobald is an actor and producer. Christopher Nolan is a director, producer, and screenwriter. Therefore, they both share the profession of being a producer. So the answer is: producer.\n\n\nWikipedia Title: passage title: Leopold Lummerstorfer\npassage title: Leopold Lummerstorfer\nLeopold Lummerstorfer (born 1968 in Gramastetten, Austria) is an Austrian film director, author and producer.  He resides in Vienna and near Kapuvár.\n\nWikipedia Title: passage title: Valeria Sarmiento\npassage title: Valeria Sarmiento\nValeria Sarmiento (born 29 October 1948) is a Chilean film editor, director and screenwriter.  She has worked both in film and television.  She has directed 19 feature films and documentaries since 1972.  Her debut feature \"Notre mariage\" (1984) was a Grand Prix winner for Best New Director at the San Sebastián International Film Festival and her 1991 film \"Amelia Lópes O'Neill\" was entered into the 41st Berlin International Film Festival.  She is the widow of Chilean film director Raúl Ruiz with whom she worked for decades as regular collaborator, editor and writer.  She has also edited films for Luc Moullet, Robert Kramer and Ventura Pons and is a Guggenheim Fellow (1988).  Her film \"Lines of Wellington\" competed for the Golden Lion at the 69th Venice International Film Festival.\n\nWikipedia Title: passage title: Niolamia\npassage title: Niolamia\nNiolamia is an extinct genus of South American meiolaniid turtle.  Arthur Smith Woodward sunk it into \"Meiolania\", but this was not accepted by later authors.  The genus is known from the Sarmiento Formation in Argentina.\n\nWikipedia Title: passage title: Amelia Lópes O'Neill\npassage title: Amelia Lópes O'Neill\nAmelia Lópes O'Neill is a 1991 Chilean drama film directed by Valeria Sarmiento.  It was entered into the 41st Berlin International Film Festival.\n\nWikipedia Title: passage title: List of Colombian writers\npassage title: List of Colombian writers\nThis List of Colombian writers is an alphabetical list of writers born or brought up in Colombia, who already have Wikipedia pages in the English or Spanish Wikipedia.  References for information given in the list appear on the Wikipedia pages concerned.  This is a subsidiary list to the List of Colombian people.  The list is far from exhaustive, so please help to expand it by adding Wikipedia page-owning published writers who have written in any genre or field, including science and scholarship, but does not include those whose sole body of work lies outside conventional published literature such as: print journalists, bloggers, editors, librettists, lyricists, songwriters, playwrights, or screenwriters.  Please follow the entry format: use Spanish naming customs by listing both surnames of the person, use \"italics\" for authors who are best known under a pseudonym, indicate only the year of birth or the years of birth and death, and do not include place of birth or works associated with the writer, as that information should be found in their actual page.\n\nWikipedia Title: passage title: Eat to Live\npassage title: Eat to Live\nEat to Live: The Amazing Nutrient-Rich Program for Fast and Sustained Weight Loss is a book written in 2003 by Dr. Joel Fuhrman, which he revised in 2011.  The book offers a formula: health = nutrients / calories.\n\nWikipedia Title: passage title: Can't Take My Eyes Off You\npassage title: Can't Take My Eyes Off You\n\"Can't Take My Eyes Off You\" is a 1967 single credited to Frankie Valli.  The song was among his biggest hits, earning a gold record and reaching No. 2 on the \"Billboard\" Hot 100 for a week, stuck behind \"Windy\" by The Association.  It was co-written by Bob Gaudio, a bandmate of Valli's in The Four Seasons.  It was Valli's biggest solo hit until he hit #1 in 1974 with \"My Eyes Adored You\".\n\nWikipedia Title: passage title: On Top of Old Smoky\npassage title: On Top of Old Smoky\n\"On Top of Old Smokey\" is a traditional folk song of the United States.  As recorded by The Weavers, the song reached the pop music charts in 1951.  It is catalogued as Roud Folk Song Index No. 414.  In one version the first verse is the following; for more on the words see below.\n\nWikipedia Title: passage title: Waltzing Matilda\npassage title: Waltzing Matilda\n\"Waltzing Matilda\" is Australia's best-known bush ballad, and has been described as the country's \"unofficial national anthem\".\n\nWikipedia Title: passage title: Time Quintet\npassage title: Time Quintet\nThe Time Quintet is a fantasy/science fiction series of five young adult novels written by Madeleine L'Engle.\n\nWikipedia Title: passage title: List of companies of India\npassage title: List of companies of India\nIndia is a country in South Asia.  It is the seventh-largest country by area, the second-most populous country (with over 1.2 billion people), and the most populous democracy in the world.\n\nWikipedia Title: passage title: 2012 Hawaii Warriors football team\npassage title: 2012 Hawaii Warriors football team\nThe 2012 Hawaii Warriors football team represented the University of Hawaii at Manoa in the 2012 NCAA Division I FBS football season.  They were led by first-year head coach Norm Chow and played their home games at Aloha Stadium.  They were first year members of the Mountain West Conference.  They finished the season 3–9, 1–7 in Mountain West play to finish in a tie for ninth place.\n\nWikipedia Title: passage title: SAIC-GM-Wuling\npassage title: SAIC-GM-Wuling\nSAIC-GM-Wuling Automobile (上汽通用五菱汽车股份有限公司 and abbreviated as SGMW) is a joint venture between SAIC Motor, General Motors, and Liuzhou Wuling Motors Co Ltd. Based in Liuzhou, Guangxi Zhuang Autonomous Region, in southwestern China, it makes commercial and consumer vehicles sold in China under the Wuling and Baojun marques, respectively.  A major mass-volume producer in the Chinese interior, in 2011 SGMW sold 1,286,000 vehicles in China, 1,445,000 in 2012, and aims to sell 2 million cars annually.  Its offerings range in price from US$5,000 to US$10,000.\n\nWikipedia Title: passage title: No. 1 Squadron RAAF\npassage title: No. 1 Squadron RAAF\nNo. 1 Squadron is a Royal Australian Air Force (RAAF) squadron headquartered at RAAF Base Amberley, Queensland.  Controlled by No. 82 Wing, it is equipped with Boeing F/A-18F Super Hornet multi-role fighters.  The squadron was formed under the Australian Flying Corps in 1916 and saw action in the Sinai and Palestine Campaigns during World War I.  It flew obsolete Royal Aircraft Factory B.E.2s, B.E.12s, Martinsyde G.100s and G.102s, as well as Airco DH.6s, Bristol Scouts and Nieuport 17s, before re-equipping with the R.E.8 in October 1917 and finally the Bristol Fighter in December.  Its commanding officer in 1917–18 was Major Richard Williams, later known as the \"Father of the RAAF\".  Disbanded in 1919, No. 1 Squadron was re-formed on paper as part of the RAAF in 1922, and re-established as an operational unit three years later.\n\nWikipedia Title: passage title: Chicago Tigers\npassage title: Chicago Tigers\nThe Chicago Tigers of the American Professional Football Association (APFA) played only in the first year of the league (1920) and, because of this, have the distinction of being the first NFL team to fold.  They had a record of 2 wins, 5 losses and 1 tie.  The team played its home games at Chicago's Wrigley Field (then called Cubs Park) and was the first NFL team to do so.  The Tigers were never formally members of the APFA.  However, since the team played seven games against APFA teams in 1920, resulting in a 1–5–1 league record, they are generally included in the league standings.\n\nQ: Are Leopold Lummerstorfer and Valeria Sarmiento both authors?\nA: Yes, both Leopold Lummerstorfer and Valeria Sarmiento are authors. Here are the answers to the questions:\n\n1. 1.", "model_response": "Yes, both Leopold Lummerstorfer and Valeria Sarmiento are authors.", "total_input_tokens": 15274, "total_output_tokens": 419, "total_tokens": 15693, "total_time_consumed": 3.9791877269744873, "step_stats": [{"iteration": 1, "type": "reasoning", "input_tokens": 2481, "output_tokens": 20}, {"iteration": 2, "type": "reasoning", "input_tokens": 2500, "output_tokens": 260}, {"iteration": 3, "type": "reasoning", "input_tokens": 2915, "output_tokens": 99}, {"iteration": 4, "type": "reasoning", "input_tokens": 3689, "output_tokens": 20}, {"iteration": 5, "type": "reasoning", "input_tokens": 3689, "output_tokens": 20}]}
{"question": "Which came to market first, \"Hey Pa! There's a Goat on the Roof\" or \"Poleconomy\"", "gold_answer": "Hey Pa! There's a Goat on the Roof", "pred_answer": "\"Hey Pa!", "is_correct": false, "collected_titles": ["passage title: Hey Pa! There's a Goat on the Roof", "passage title: Poleconomy", "passage title: Rove goat", "passage title: Farmer Al Falfa", "passage title: Felix the Cat", "passage title: List of The Simpsons comics", "passage title: Field Enterprises", "passage title: Scandinavian folklore", "passage title: Tu Ángel de la Guarda", "passage title: Grampa Simpson", "passage title: Pahang Malay", "passage title: Live @ the D.C. Star"], "collected_passages": ["passage title: Hey Pa! There's a Goat on the Roof\nHey Pa!  There's a Goat on the Roof was a children's board game issued by Parker Brothers in 1966.", "passage title: Poleconomy\nPoleconomy is a board game invented by New Zealander Bruce E. Hatherley and first published in 1980.  It is similar to \"Monopoly\" but the board is divided into companies rather than properties.  Players compete to acquire properties and investments through stylized economic and political activity.  The playing time is set by agreement from all players, e.g. 2 hours, and the winner is determined by the monetary sum of all player cash, companies, insurance or other assets.  The game can also end when there are no more companies, advertisements in the bank or bonds in the treasury.  Another objective of the game is \"to teach players some of the fundamentals of economics, and the ways in which the economy and the government interact.\"  Different editions were published for several different countries.  The name \"Poleconomy\" is a portmanteau of \"politics\" and \"economy\".", "passage title: Rove goat\nThe Rove is a breed of goat first domesticated in France.  The breed was previously considered endangered, but as of 2003, more than 5000 registered Roves are on French farms.  The goat was originally bred for meat, but because the current French market for goat meat is poor, farmers have begun to use the Rove for dairying, instead.", "passage title: Farmer Al Falfa\nFarmer Al Falfa (also known as Farmer Alfalfa), the quintessential grizzly old farmer type, is an animated cartoon character created by American cartoonist Paul Terry.  He first appeared in \"Down On the Phoney Farm\" (1915), a short Terry cartoon distributed by the Thanhouser Company.  Next came a series of shorts produced by Terry for Bray Studios, starting with \"Farmer Al Falfa's Cat-Tastrophe\" (1916).", "passage title: Felix the Cat\nFelix the Cat is a funny-animal cartoon character created in the silent film era.  The anthropomorphic black cat with his black body, white eyes, and giant grin, coupled with the surrealism of the situations in which his cartoons place him, combine to make Felix one of the most recognized cartoon characters in film history.  Felix was the first character from animation to attain a level of popularity sufficient to draw movie audiences.", "passage title: List of The Simpsons comics\nThe following is a list of comic book series based on the animated TV show The Simpsons and published by Bongo Comics in the United States.  The first comic strips based on \"The Simpsons\" appeared in 1991 in the magazine \"Simpsons Illustrated\" (not to be confused with the comic publications from 2012 bearing the same name), which was a companion magazine to the show.  The comic strips were popular and a one-shot comic book entitled \"Simpsons Comics and Stories\", containing three different stories, was released in 1993 for the fans.  The book was a success and due to this, the creator of \"The Simpsons\", Matt Groening, and his companions Bill Morrison, Mike Rote, Steve Vance and Cindy Vance created the publishing company Bongo Comics.  By the end of 1993, Bongo was publishing four titles: \"Simpsons Comics\", \"Bartman\", \"Radioactive Man\" and \"Itchy & Scratchy Comics\".  Since then, many more titles have been published, out of which \"Simpsons Comics\", \"Bart Simpson\", \"Bart Simpson's Treehouse of Horror\", \"Simpsons Super Spectacular\", Simpsons Summer Shindig, and \"Simpsons Winter Wingding\".", "passage title: Field Enterprises\nField Enterprises was a private holding company founded on August 31, 1944, by Marshall Field III and others whose main asset was the \"Chicago Sun\".  That same year the company acquired the book publishers Simon & Schuster and Pocket Books.", "passage title: Scandinavian folklore\nScandinavian folklore or Nordic folklore is the folklore of Norway, Sweden, Finland, Denmark, Iceland and the Faroe Islands.", "passage title: Tu Ángel de la Guarda\nTu Ángel de la Guarda (\"Your guardian angel\") is Gloria Trevi's second album, and it contained one of her signature songs and her most widely known hit, \"Pelo Suelto\".  It also contained other hit songs such as \"Tu angel de la guarda\", \"Ya no\", \"Virgen de las virgenes\", and \"Hoy me ire de casa\".  This album was very controversial different from other artists' albums such as Lucero.  \"Virgen de las virgenes\" mocked girls who said they were virgins but had actually lost their virginity, and \"¡Ya no!\"  went against the machismo movement of México.  Following the release of the album, Gloria was working hard in promoting radio, television and print media.  Trevi first traveled abroad visiting American Union countries, Puerto Rico, Argentina, Colombia, Guatemala, Venezuela, Costa Rica, and received a Gold and Platinum for high sales achieved.", "passage title: Grampa Simpson\nAbraham Jedediah Simpson II, often known as Grampa, is a fictional character in the animated television series \"The Simpsons\".  He made his first appearance in the episode entitled \"Grampa and the Kids\", a Simpsons short on \"The Tracey Ullman Show\".  Voiced by Dan Castellaneta, he is the father of Homer Simpson and the grandfather of Bart, Lisa and Maggie Simpson.  In the 1000th issue of \"Entertainment Weekly\", Grampa was selected as the Grandpa for \"The Perfect TV Family\".", "passage title: Pahang Malay\nPahang Malay (Standard Malay: \"Bahasa Melayu Pahang\"; Jawi: بهاس ملايو ڤهڠ) is a dialect of Malay language spoken in the Malaysian state of Pahang.  It is regarded as the dominant Malay dialect spoken along the vast riverine systems of Pahang, but co-exists with other Malay dialects traditionally spoken in the state.  Along the coastline of Pahang, Terengganu Malay is spoken in a narrow strip of sometimes discontiguous fishermen villages and towns.  Another dialect spoken in Tioman island is a distinct Malay variant and most closely related to Riau Archipelago Malay subdialect spoken in Natuna and Anambas islands in the South China Sea, together forming a dialect continuum between the Bornean Malay with the Mainland Peninsular/Sumatran Malay.", "passage title: Live @ the D.C. Star\nLive @ the D.C. Star (also titled as Live PA #12: Live @ the D.C. Star) is a live album released on June 15, 2010 by the Washington, D.C.-based go-go band Rare Essence.  The album was recorded live on April 17, 2010 at the D.C. Star, a music venue located in Northeast, Washington, D.C."], "generated_sentences": ["Poleconomy was first published in 1980, while \"Hey Pa!", "\"Hey Pa!"], "model_input": "Wikipedia Title: Nobody Loves You (When You're Down and Out)\n\"Nobody Loves You (When You're Down and Out)\" is a song written by John Lennon released on his 1974 album \"Walls and Bridges\". The song is included on the 1986 compilation \"Menlove Ave.\", the 1990 boxset \"Lennon\", the 1998 boxset \"John Lennon Anthology\", the 2005 two-disc compilation \"\", and the 2010 boxset \"Gimme Some Truth\".\n\nWikipedia Title: John Lennon/Plastic Ono Band\nJohn Lennon/Plastic Ono Band is the debut studio album by English rock musician John Lennon. It was released in 1970, after Lennon had issued three experimental albums with Yoko Ono and \"Live Peace in Toronto 1969\", a live performance in Toronto credited to the Plastic Ono Band. The album was recorded simultaneously with Ono's debut avant garde solo album, \"Yoko Ono/Plastic Ono Band\", at Ascot Sound Studios and Abbey Road Studios using the same musicians and production team and nearly identical cover artwork.\n\nWikipedia Title: Mother (John Lennon song)\n\"Mother\" is a song by English musician John Lennon, first released on his 1970 album \"John Lennon/Plastic Ono Band\". An edited version of the song was issued as a single in the United States on Apple Records, on 28 December 1970. The single runs about 1:41 shorter than the album due to a lack of the tolling bells intro and a quicker fadeout. The B-side features \"Why\" by Yoko Ono. The song peaked in the US at number 19 on the \"Cashbox\" Top 100 and number 43 on the \"Billboard\" Hot 100.\n\nWikipedia Title: Walls and Bridges\nWalls and Bridges is the fifth studio album by English musician John Lennon. It was issued by Apple Records on 26 September 1974 in the United States and on 4 October in the United Kingdom. Written, recorded and released during his 18-month separation from Yoko Ono, the album captured Lennon in the midst of his \"Lost Weekend\". \"Walls and Bridges\" was an American \"Billboard\" number-one album and featured two hit singles, \"Whatever Gets You thru the Night\" and \"#9 Dream\". The first of these was Lennon's first number-one hit in the United States as a solo artist, and his only chart-topping single in either the US or Britain during his lifetime.\n\nQ: Nobody Loves You was written by John Lennon and released on what album that was issued by Apple Records, and was written, recorded, and released during his 18 month separation from Yoko Ono?\nA: The album issued by Apple Records, and written, recorded, and released during John Lennon's 18 month separation from Yoko Ono is Walls and Bridges. Nobody Loves You was written by John Lennon on Walls and Bridges album. So the answer is: Walls and Bridges.\n\n\nWikipedia Title: Route 13 (Laos)\nRoute 13 is the most important highway in the country of Laos. It begins at Boten in the North of Laos at the Chinese border. It connects the city of Vientiane to Luang Prabang in the north and roughly follows the line of the Mekong River down to the border with Cambodia. The road then continues at National Highway 7 in Cambodia. Also this national highway leads past all three international airports in Laos Vientiane Airport, Luang Prabang Airport and Pakse Airport. Between Boten and Nateuy the Route 13 is at a length of 20 km part of the Kunming-Bangkok Expressway, which is also part of the Asian Highway AH3. From Nateuy to Vientiane, the Route 13 is part of the AH12 and from Vientiane to the border of Cambodia AH11.\n\nWikipedia Title: National Route 13 (Vietnam)\nNational Route 13 (Vietnamese: \"Quốc lộ 13\" ) is a highway in southern Vietnam stretching from the northeastern outskirts of Ho Chi Minh City, the commercial centre of the country, towards the border to Cambodia. The highway starts around Thủ Đức on the northern outskirts of Ho Chi Minh City, once the site of the military academy of the Army of the Republic of Vietnam, and travels north through the provinces of Bình Dương and Bình Phước. The highway passes through the districts of Thuận An, Thủ Dầu Một town, Bến Cát, Chơn Thành, Đồng Phú, Bình Long, and Lộc Ninh.\n\nWikipedia Title: Glen Osmond, South Australia\nGlen Osmond is a suburb of Adelaide, South Australia in the City of Burnside which is in the foothills of the Adelaide Hills. It is well known for the road intersection on the western side of the suburb, where the South Eastern Freeway (National Route M1) from the Adelaide Hills and the main route from Melbourne splits into National Route A17 Portrush Road (north, the main route towards Port Adelaide), Glen Osmond Road, Adelaide (northwest towards Adelaide city centre) and state route A3 Cross Road west towards the coast and southern suburbs.\n\nWikipedia Title: Cambodia\nCambodia ( ; Khmer: កម្ពុជា , or Kampuchea ] ), officially known as the Kingdom of Cambodia (Khmer: ព្រះរាជាណាចក្រកម្ពុជា , \"Preăh Réachéanachâk Kâmpŭchéa\", ] ), is a country located in the southern portion of the Indochina Peninsula in Southeast Asia. It is 181035 km2 in area, bordered by Thailand to the northwest, Laos to the northeast, Vietnam to the east, and the Gulf of Thailand to the southwest.\n\nQ: What is known as the Kingdom and has National Route 13 stretching towards its border?\nA: Cambodia is officially known as the Kingdom of Cambodia. National Route 13 streches towards border to Cambodia. So the answer is: Cambodia.\n\n\nWikipedia Title: James Draper (settler)\nJames Draper (1618–1694) was an early settler of the Massachusetts Bay Colony. He was born and married in Heptonstall, Yorkshire, England, and came with his wife to New England shortly after 1647. He was a weaver by profession, and settled in the Massachusetts town of Roxbury, but also lived for a short while in the towns of Dedham and Charlestown. He and his wife had nine children and many notable descendants. They are buried in the Westerly Burial Ground in West Roxbury, now a neighborhood of Boston, and share the oldest marker in the cemetery.\n\nWikipedia Title: Jeremy Theobald\nJeremy Theobald is a British actor best known for his portrayal of \"The Young Man\", the main character in Christopher Nolan's 1998 major picture debut \"Following\", and for which Theobald was also a producer, Filming was scheduled around their day jobs. Jonathan Romney, writing in the \"New Statesman\", noted that \"Nolan and his cast are terrific finds: I wouldn't normally say this to struggling artists, but they might want to give up their day jobs.\"\n\nWikipedia Title: Christopher Nolan\nChristopher Edward Nolan ( ; born 30 July 1970) is an English-American film director, producer, and screenwriter. He is one of the highest-grossing directors in history, and among the most successful and acclaimed filmmakers of the 21st century.\n\nWikipedia Title: Semper Gestion\nSemper is a Swiss wealth management company, asset management and Family Office established in 2001 and working in open architecture. Based in Geneva, with a team of highly skilled portfolio managers who share a common vision of the profession, its model and its values, Semper has a sister company in London (Beauregard Capital Limited) and a representative office in Shanghai (Shanghai Semper). Since 2001, she offers a highly personalized service of wealth management and Family Office. Managed by Grégoire Vaucher (CEO) and Jean-Evrard Dominicé (CIO), Semper currently has 20 employees.\n\nQ: Jeremy Theobald and Christopher Nolan share what profession?\nA: Jeremy Theobald is an actor and producer. Christopher Nolan is a director, producer, and screenwriter. Therefore, they both share the profession of being a producer. So the answer is: producer.\n\n\nWikipedia Title: passage title: Hey Pa! There's a Goat on the Roof\npassage title: Hey Pa! There's a Goat on the Roof\nHey Pa!  There's a Goat on the Roof was a children's board game issued by Parker Brothers in 1966.\n\nWikipedia Title: passage title: Poleconomy\npassage title: Poleconomy\nPoleconomy is a board game invented by New Zealander Bruce E. Hatherley and first published in 1980.  It is similar to \"Monopoly\" but the board is divided into companies rather than properties.  Players compete to acquire properties and investments through stylized economic and political activity.  The playing time is set by agreement from all players, e.g. 2 hours, and the winner is determined by the monetary sum of all player cash, companies, insurance or other assets.  The game can also end when there are no more companies, advertisements in the bank or bonds in the treasury.  Another objective of the game is \"to teach players some of the fundamentals of economics, and the ways in which the economy and the government interact.\"  Different editions were published for several different countries.  The name \"Poleconomy\" is a portmanteau of \"politics\" and \"economy\".\n\nWikipedia Title: passage title: Rove goat\npassage title: Rove goat\nThe Rove is a breed of goat first domesticated in France.  The breed was previously considered endangered, but as of 2003, more than 5000 registered Roves are on French farms.  The goat was originally bred for meat, but because the current French market for goat meat is poor, farmers have begun to use the Rove for dairying, instead.\n\nWikipedia Title: passage title: Farmer Al Falfa\npassage title: Farmer Al Falfa\nFarmer Al Falfa (also known as Farmer Alfalfa), the quintessential grizzly old farmer type, is an animated cartoon character created by American cartoonist Paul Terry.  He first appeared in \"Down On the Phoney Farm\" (1915), a short Terry cartoon distributed by the Thanhouser Company.  Next came a series of shorts produced by Terry for Bray Studios, starting with \"Farmer Al Falfa's Cat-Tastrophe\" (1916).\n\nWikipedia Title: passage title: Felix the Cat\npassage title: Felix the Cat\nFelix the Cat is a funny-animal cartoon character created in the silent film era.  The anthropomorphic black cat with his black body, white eyes, and giant grin, coupled with the surrealism of the situations in which his cartoons place him, combine to make Felix one of the most recognized cartoon characters in film history.  Felix was the first character from animation to attain a level of popularity sufficient to draw movie audiences.\n\nWikipedia Title: passage title: List of The Simpsons comics\npassage title: List of The Simpsons comics\nThe following is a list of comic book series based on the animated TV show The Simpsons and published by Bongo Comics in the United States.  The first comic strips based on \"The Simpsons\" appeared in 1991 in the magazine \"Simpsons Illustrated\" (not to be confused with the comic publications from 2012 bearing the same name), which was a companion magazine to the show.  The comic strips were popular and a one-shot comic book entitled \"Simpsons Comics and Stories\", containing three different stories, was released in 1993 for the fans.  The book was a success and due to this, the creator of \"The Simpsons\", Matt Groening, and his companions Bill Morrison, Mike Rote, Steve Vance and Cindy Vance created the publishing company Bongo Comics.  By the end of 1993, Bongo was publishing four titles: \"Simpsons Comics\", \"Bartman\", \"Radioactive Man\" and \"Itchy & Scratchy Comics\".  Since then, many more titles have been published, out of which \"Simpsons Comics\", \"Bart Simpson\", \"Bart Simpson's Treehouse of Horror\", \"Simpsons Super Spectacular\", Simpsons Summer Shindig, and \"Simpsons Winter Wingding\".\n\nWikipedia Title: passage title: Field Enterprises\npassage title: Field Enterprises\nField Enterprises was a private holding company founded on August 31, 1944, by Marshall Field III and others whose main asset was the \"Chicago Sun\".  That same year the company acquired the book publishers Simon & Schuster and Pocket Books.\n\nWikipedia Title: passage title: Scandinavian folklore\npassage title: Scandinavian folklore\nScandinavian folklore or Nordic folklore is the folklore of Norway, Sweden, Finland, Denmark, Iceland and the Faroe Islands.\n\nWikipedia Title: passage title: Tu Ángel de la Guarda\npassage title: Tu Ángel de la Guarda\nTu Ángel de la Guarda (\"Your guardian angel\") is Gloria Trevi's second album, and it contained one of her signature songs and her most widely known hit, \"Pelo Suelto\".  It also contained other hit songs such as \"Tu angel de la guarda\", \"Ya no\", \"Virgen de las virgenes\", and \"Hoy me ire de casa\".  This album was very controversial different from other artists' albums such as Lucero.  \"Virgen de las virgenes\" mocked girls who said they were virgins but had actually lost their virginity, and \"¡Ya no!\"  went against the machismo movement of México.  Following the release of the album, Gloria was working hard in promoting radio, television and print media.  Trevi first traveled abroad visiting American Union countries, Puerto Rico, Argentina, Colombia, Guatemala, Venezuela, Costa Rica, and received a Gold and Platinum for high sales achieved.\n\nWikipedia Title: passage title: Grampa Simpson\npassage title: Grampa Simpson\nAbraham Jedediah Simpson II, often known as Grampa, is a fictional character in the animated television series \"The Simpsons\".  He made his first appearance in the episode entitled \"Grampa and the Kids\", a Simpsons short on \"The Tracey Ullman Show\".  Voiced by Dan Castellaneta, he is the father of Homer Simpson and the grandfather of Bart, Lisa and Maggie Simpson.  In the 1000th issue of \"Entertainment Weekly\", Grampa was selected as the Grandpa for \"The Perfect TV Family\".\n\nWikipedia Title: passage title: Pahang Malay\npassage title: Pahang Malay\nPahang Malay (Standard Malay: \"Bahasa Melayu Pahang\"; Jawi: بهاس ملايو ڤهڠ) is a dialect of Malay language spoken in the Malaysian state of Pahang.  It is regarded as the dominant Malay dialect spoken along the vast riverine systems of Pahang, but co-exists with other Malay dialects traditionally spoken in the state.  Along the coastline of Pahang, Terengganu Malay is spoken in a narrow strip of sometimes discontiguous fishermen villages and towns.  Another dialect spoken in Tioman island is a distinct Malay variant and most closely related to Riau Archipelago Malay subdialect spoken in Natuna and Anambas islands in the South China Sea, together forming a dialect continuum between the Bornean Malay with the Mainland Peninsular/Sumatran Malay.\n\nWikipedia Title: passage title: Live @ the D.C. Star\npassage title: Live @ the D.C. Star\nLive @ the D.C. Star (also titled as Live PA #12: Live @ the D.C. Star) is a live album released on June 15, 2010 by the Washington, D.C.-based go-go band Rare Essence.  The album was recorded live on April 17, 2010 at the D.C. Star, a music venue located in Northeast, Washington, D.C.\n\nQ: Which came to market first, \"Hey Pa! There's a Goat on the Roof\" or \"Poleconomy\"\nA: Poleconomy was first published in 1980, while \"Hey Pa! \"Hey Pa!", "model_response": "Poleconomy was first published in 1980, while \"Hey Pa! There's a Goat on the Roof\" was issued by Parker Brothers in 1966.", "total_input_tokens": 15762, "total_output_tokens": 211, "total_tokens": 15973, "total_time_consumed": 2.185053825378418, "step_stats": [{"iteration": 1, "type": "reasoning", "input_tokens": 2421, "output_tokens": 54}, {"iteration": 2, "type": "reasoning", "input_tokens": 2829, "output_tokens": 52}, {"iteration": 3, "type": "reasoning", "input_tokens": 3504, "output_tokens": 35}, {"iteration": 4, "type": "reasoning", "input_tokens": 3504, "output_tokens": 35}, {"iteration": 5, "type": "reasoning", "input_tokens": 3504, "output_tokens": 35}]}
{"question": "Who was older when they died, Teinosuke Kinugasa or Don O. Newland", "gold_answer": "Teinosuke Kinugasa", "pred_answer": "Walls and Bridges", "is_correct": false, "collected_titles": ["passage title: Teinosuke Kinugasa", "passage title: Don O. Newland", "passage title: A Girl Isn't Allowed to Love", "passage title: Dedication of the Great Buddha", "passage title: The Romance of Yushima", "passage title: A Page of Madness", "passage title: Tsukigata Hanpeita: Hana no maki; Arashi no maki", "passage title: Eat to Live", "passage title: Can't Take My Eyes Off You", "passage title: On Top of Old Smoky", "passage title: Waltzing Matilda", "passage title: Time Quintet"], "collected_passages": ["passage title: Teinosuke Kinugasa\nTeinosuke Kinugasa (衣笠 貞之助 , Kinugasa Teinosuke ) (1 January 1896 – 26 February 1982) was a Japanese actor and film director.  He was born in Kameyama, Mie Prefecture and died in Kyoto.  Kinugasa won the 1954 Palme d'or at Cannes for \"Jigokumon\" (\"The Gate of Hell\").", "passage title: Don O. Newland\nDon Oliver Newland (1896–1951) was an American film director and producer whose career consisted largely of itinerant work.  From the 1920s until his death, he traveled to cities throughout the United States making films that employed local citizens as stars and extras.  Using a standard script, Newland personalized each film according to its location – \"Belvidere's Hero\", \"Staunton's Hero\", \"Janesville's Hero\", \"Huntingdon's Hero\", \"Tyrone's Hero\", \"Wilmington's Hero\", and so on.", "passage title: A Girl Isn't Allowed to Love\nA Girl Isn't Allowed to Love a.k.a. \"The Rose Again\" (薔薇いくたびか , Bara ikutabika ) is a 1955 Japanese film directed by Teinosuke Kinugasa.", "passage title: Dedication of the Great Buddha\nDedication of the Great Buddha (大仏開眼 , Daibutsu kaigen ) is a 1952 Japanese film directed by Teinosuke Kinugasa.  It was entered into the 1953 Cannes Film Festival.", "passage title: The Romance of Yushima\nThe Romance of Yushima (婦系図 湯島の白梅 , Onna Keizu Yushima no Shiraume ) (おんなけいず ゆしまのしらうめ), aka \"The White Plum of Yushima\", is a 1955 black-and-white Japanese film directed by Teinosuke Kinugasa.", "passage title: A Page of Madness\nA Page of Madness (狂った一頁 , Kurutta Ippēji or Kurutta Ichipeiji ) is a silent film by Japanese film director Teinosuke Kinugasa, made in 1926.  It was lost for forty-five years until being rediscovered by Kinugasa in his storehouse in 1971.  The film is the product of an avant-garde group of artists in Japan known as the Shinkankakuha (or School of New Perceptions) who tried to overcome naturalistic representation.", "passage title: Tsukigata Hanpeita: Hana no maki; Arashi no maki\nTsukigata Hanpeita: Hana no maki; Arashi no maki (月形半平太　花の巻　嵐の巻) is a 1956 Japanese film directed by Teinosuke Kinugasa.", "passage title: Eat to Live\nEat to Live: The Amazing Nutrient-Rich Program for Fast and Sustained Weight Loss is a book written in 2003 by Dr. Joel Fuhrman, which he revised in 2011.  The book offers a formula: health = nutrients / calories.", "passage title: Can't Take My Eyes Off You\n\"Can't Take My Eyes Off You\" is a 1967 single credited to Frankie Valli.  The song was among his biggest hits, earning a gold record and reaching No. 2 on the \"Billboard\" Hot 100 for a week, stuck behind \"Windy\" by The Association.  It was co-written by Bob Gaudio, a bandmate of Valli's in The Four Seasons.  It was Valli's biggest solo hit until he hit #1 in 1974 with \"My Eyes Adored You\".", "passage title: On Top of Old Smoky\n\"On Top of Old Smokey\" is a traditional folk song of the United States.  As recorded by The Weavers, the song reached the pop music charts in 1951.  It is catalogued as Roud Folk Song Index No. 414.  In one version the first verse is the following; for more on the words see below.", "passage title: Waltzing Matilda\n\"Waltzing Matilda\" is Australia's best-known bush ballad, and has been described as the country's \"unofficial national anthem\".", "passage title: Time Quintet\nThe Time Quintet is a fantasy/science fiction series of five young adult novels written by Madeleine L'Engle."], "generated_sentences": ["To answer this question, we need to know the year of death for both Teinosuke Kinugasa and Don O. Newland.", "Teinosuke Kinugasa died on 26 February 1982, and Don O. Newland died in 1951.", "Don O. Newland was older when he died, as he died in 1951, whereas Teinosuke Kinugasa died in 1982.", "Here are the answers to the questions:\n\n1.", "1."], "model_input": "Wikipedia Title: Nobody Loves You (When You're Down and Out)\n\"Nobody Loves You (When You're Down and Out)\" is a song written by John Lennon released on his 1974 album \"Walls and Bridges\". The song is included on the 1986 compilation \"Menlove Ave.\", the 1990 boxset \"Lennon\", the 1998 boxset \"John Lennon Anthology\", the 2005 two-disc compilation \"\", and the 2010 boxset \"Gimme Some Truth\".\n\nWikipedia Title: John Lennon/Plastic Ono Band\nJohn Lennon/Plastic Ono Band is the debut studio album by English rock musician John Lennon. It was released in 1970, after Lennon had issued three experimental albums with Yoko Ono and \"Live Peace in Toronto 1969\", a live performance in Toronto credited to the Plastic Ono Band. The album was recorded simultaneously with Ono's debut avant garde solo album, \"Yoko Ono/Plastic Ono Band\", at Ascot Sound Studios and Abbey Road Studios using the same musicians and production team and nearly identical cover artwork.\n\nWikipedia Title: Mother (John Lennon song)\n\"Mother\" is a song by English musician John Lennon, first released on his 1970 album \"John Lennon/Plastic Ono Band\". An edited version of the song was issued as a single in the United States on Apple Records, on 28 December 1970. The single runs about 1:41 shorter than the album due to a lack of the tolling bells intro and a quicker fadeout. The B-side features \"Why\" by Yoko Ono. The song peaked in the US at number 19 on the \"Cashbox\" Top 100 and number 43 on the \"Billboard\" Hot 100.\n\nWikipedia Title: Walls and Bridges\nWalls and Bridges is the fifth studio album by English musician John Lennon. It was issued by Apple Records on 26 September 1974 in the United States and on 4 October in the United Kingdom. Written, recorded and released during his 18-month separation from Yoko Ono, the album captured Lennon in the midst of his \"Lost Weekend\". \"Walls and Bridges\" was an American \"Billboard\" number-one album and featured two hit singles, \"Whatever Gets You thru the Night\" and \"#9 Dream\". The first of these was Lennon's first number-one hit in the United States as a solo artist, and his only chart-topping single in either the US or Britain during his lifetime.\n\nQ: Nobody Loves You was written by John Lennon and released on what album that was issued by Apple Records, and was written, recorded, and released during his 18 month separation from Yoko Ono?\nA: The album issued by Apple Records, and written, recorded, and released during John Lennon's 18 month separation from Yoko Ono is Walls and Bridges. Nobody Loves You was written by John Lennon on Walls and Bridges album. So the answer is: Walls and Bridges.\n\n\nWikipedia Title: Route 13 (Laos)\nRoute 13 is the most important highway in the country of Laos. It begins at Boten in the North of Laos at the Chinese border. It connects the city of Vientiane to Luang Prabang in the north and roughly follows the line of the Mekong River down to the border with Cambodia. The road then continues at National Highway 7 in Cambodia. Also this national highway leads past all three international airports in Laos Vientiane Airport, Luang Prabang Airport and Pakse Airport. Between Boten and Nateuy the Route 13 is at a length of 20 km part of the Kunming-Bangkok Expressway, which is also part of the Asian Highway AH3. From Nateuy to Vientiane, the Route 13 is part of the AH12 and from Vientiane to the border of Cambodia AH11.\n\nWikipedia Title: National Route 13 (Vietnam)\nNational Route 13 (Vietnamese: \"Quốc lộ 13\" ) is a highway in southern Vietnam stretching from the northeastern outskirts of Ho Chi Minh City, the commercial centre of the country, towards the border to Cambodia. The highway starts around Thủ Đức on the northern outskirts of Ho Chi Minh City, once the site of the military academy of the Army of the Republic of Vietnam, and travels north through the provinces of Bình Dương and Bình Phước. The highway passes through the districts of Thuận An, Thủ Dầu Một town, Bến Cát, Chơn Thành, Đồng Phú, Bình Long, and Lộc Ninh.\n\nWikipedia Title: Glen Osmond, South Australia\nGlen Osmond is a suburb of Adelaide, South Australia in the City of Burnside which is in the foothills of the Adelaide Hills. It is well known for the road intersection on the western side of the suburb, where the South Eastern Freeway (National Route M1) from the Adelaide Hills and the main route from Melbourne splits into National Route A17 Portrush Road (north, the main route towards Port Adelaide), Glen Osmond Road, Adelaide (northwest towards Adelaide city centre) and state route A3 Cross Road west towards the coast and southern suburbs.\n\nWikipedia Title: Cambodia\nCambodia ( ; Khmer: កម្ពុជា , or Kampuchea ] ), officially known as the Kingdom of Cambodia (Khmer: ព្រះរាជាណាចក្រកម្ពុជា , \"Preăh Réachéanachâk Kâmpŭchéa\", ] ), is a country located in the southern portion of the Indochina Peninsula in Southeast Asia. It is 181035 km2 in area, bordered by Thailand to the northwest, Laos to the northeast, Vietnam to the east, and the Gulf of Thailand to the southwest.\n\nQ: What is known as the Kingdom and has National Route 13 stretching towards its border?\nA: Cambodia is officially known as the Kingdom of Cambodia. National Route 13 streches towards border to Cambodia. So the answer is: Cambodia.\n\n\nWikipedia Title: James Draper (settler)\nJames Draper (1618–1694) was an early settler of the Massachusetts Bay Colony. He was born and married in Heptonstall, Yorkshire, England, and came with his wife to New England shortly after 1647. He was a weaver by profession, and settled in the Massachusetts town of Roxbury, but also lived for a short while in the towns of Dedham and Charlestown. He and his wife had nine children and many notable descendants. They are buried in the Westerly Burial Ground in West Roxbury, now a neighborhood of Boston, and share the oldest marker in the cemetery.\n\nWikipedia Title: Jeremy Theobald\nJeremy Theobald is a British actor best known for his portrayal of \"The Young Man\", the main character in Christopher Nolan's 1998 major picture debut \"Following\", and for which Theobald was also a producer, Filming was scheduled around their day jobs. Jonathan Romney, writing in the \"New Statesman\", noted that \"Nolan and his cast are terrific finds: I wouldn't normally say this to struggling artists, but they might want to give up their day jobs.\"\n\nWikipedia Title: Christopher Nolan\nChristopher Edward Nolan ( ; born 30 July 1970) is an English-American film director, producer, and screenwriter. He is one of the highest-grossing directors in history, and among the most successful and acclaimed filmmakers of the 21st century.\n\nWikipedia Title: Semper Gestion\nSemper is a Swiss wealth management company, asset management and Family Office established in 2001 and working in open architecture. Based in Geneva, with a team of highly skilled portfolio managers who share a common vision of the profession, its model and its values, Semper has a sister company in London (Beauregard Capital Limited) and a representative office in Shanghai (Shanghai Semper). Since 2001, she offers a highly personalized service of wealth management and Family Office. Managed by Grégoire Vaucher (CEO) and Jean-Evrard Dominicé (CIO), Semper currently has 20 employees.\n\nQ: Jeremy Theobald and Christopher Nolan share what profession?\nA: Jeremy Theobald is an actor and producer. Christopher Nolan is a director, producer, and screenwriter. Therefore, they both share the profession of being a producer. So the answer is: producer.\n\n\nWikipedia Title: passage title: Teinosuke Kinugasa\npassage title: Teinosuke Kinugasa\nTeinosuke Kinugasa (衣笠 貞之助 , Kinugasa Teinosuke ) (1 January 1896 – 26 February 1982) was a Japanese actor and film director.  He was born in Kameyama, Mie Prefecture and died in Kyoto.  Kinugasa won the 1954 Palme d'or at Cannes for \"Jigokumon\" (\"The Gate of Hell\").\n\nWikipedia Title: passage title: Don O. Newland\npassage title: Don O. Newland\nDon Oliver Newland (1896–1951) was an American film director and producer whose career consisted largely of itinerant work.  From the 1920s until his death, he traveled to cities throughout the United States making films that employed local citizens as stars and extras.  Using a standard script, Newland personalized each film according to its location – \"Belvidere's Hero\", \"Staunton's Hero\", \"Janesville's Hero\", \"Huntingdon's Hero\", \"Tyrone's Hero\", \"Wilmington's Hero\", and so on.\n\nWikipedia Title: passage title: A Girl Isn't Allowed to Love\npassage title: A Girl Isn't Allowed to Love\nA Girl Isn't Allowed to Love a.k.a. \"The Rose Again\" (薔薇いくたびか , Bara ikutabika ) is a 1955 Japanese film directed by Teinosuke Kinugasa.\n\nWikipedia Title: passage title: Dedication of the Great Buddha\npassage title: Dedication of the Great Buddha\nDedication of the Great Buddha (大仏開眼 , Daibutsu kaigen ) is a 1952 Japanese film directed by Teinosuke Kinugasa.  It was entered into the 1953 Cannes Film Festival.\n\nWikipedia Title: passage title: The Romance of Yushima\npassage title: The Romance of Yushima\nThe Romance of Yushima (婦系図 湯島の白梅 , Onna Keizu Yushima no Shiraume ) (おんなけいず ゆしまのしらうめ), aka \"The White Plum of Yushima\", is a 1955 black-and-white Japanese film directed by Teinosuke Kinugasa.\n\nWikipedia Title: passage title: A Page of Madness\npassage title: A Page of Madness\nA Page of Madness (狂った一頁 , Kurutta Ippēji or Kurutta Ichipeiji ) is a silent film by Japanese film director Teinosuke Kinugasa, made in 1926.  It was lost for forty-five years until being rediscovered by Kinugasa in his storehouse in 1971.  The film is the product of an avant-garde group of artists in Japan known as the Shinkankakuha (or School of New Perceptions) who tried to overcome naturalistic representation.\n\nWikipedia Title: passage title: Tsukigata Hanpeita: Hana no maki; Arashi no maki\npassage title: Tsukigata Hanpeita: Hana no maki; Arashi no maki\nTsukigata Hanpeita: Hana no maki; Arashi no maki (月形半平太　花の巻　嵐の巻) is a 1956 Japanese film directed by Teinosuke Kinugasa.\n\nWikipedia Title: passage title: Eat to Live\npassage title: Eat to Live\nEat to Live: The Amazing Nutrient-Rich Program for Fast and Sustained Weight Loss is a book written in 2003 by Dr. Joel Fuhrman, which he revised in 2011.  The book offers a formula: health = nutrients / calories.\n\nWikipedia Title: passage title: Can't Take My Eyes Off You\npassage title: Can't Take My Eyes Off You\n\"Can't Take My Eyes Off You\" is a 1967 single credited to Frankie Valli.  The song was among his biggest hits, earning a gold record and reaching No. 2 on the \"Billboard\" Hot 100 for a week, stuck behind \"Windy\" by The Association.  It was co-written by Bob Gaudio, a bandmate of Valli's in The Four Seasons.  It was Valli's biggest solo hit until he hit #1 in 1974 with \"My Eyes Adored You\".\n\nWikipedia Title: passage title: On Top of Old Smoky\npassage title: On Top of Old Smoky\n\"On Top of Old Smokey\" is a traditional folk song of the United States.  As recorded by The Weavers, the song reached the pop music charts in 1951.  It is catalogued as Roud Folk Song Index No. 414.  In one version the first verse is the following; for more on the words see below.\n\nWikipedia Title: passage title: Waltzing Matilda\npassage title: Waltzing Matilda\n\"Waltzing Matilda\" is Australia's best-known bush ballad, and has been described as the country's \"unofficial national anthem\".\n\nWikipedia Title: passage title: Time Quintet\npassage title: Time Quintet\nThe Time Quintet is a fantasy/science fiction series of five young adult novels written by Madeleine L'Engle.\n\nQ: Who was older when they died, Teinosuke Kinugasa or Don O. Newland\nA: To answer this question, we need to know the year of death for both Teinosuke Kinugasa and Don O. Newland. Teinosuke Kinugasa died on 26 February 1982, and Don O. Newland died in 1951. Don O. Newland was older when he died, as he died in 1951, whereas Teinosuke Kinugasa died in 1982. Here are the answers to the questions:\n\n1.", "model_response": "1. The album issued by Apple Records, and written, recorded, and released during John Lennon's 18 month separation from Yoko Ono is Walls and Bridges. Nobody Loves You was written by John Lennon on Walls and Bridges album. So the answer is: Walls and Bridges.\n\n2. Cambodia is officially known as the Kingdom of Cambodia. National Route 13 stretches towards border to Cambodia. So the answer is: Cambodia.\n\n3. Jeremy Theobald is an actor and producer. Christopher Nolan is a director, producer, and screenwriter. Therefore, they both share the profession of being a producer. So the answer is: producer.\n\n4. Teinosuke Kinugasa was older when he died, as he died in 1982, whereas Don O. Newland died in 1951.", "total_input_tokens": 13198, "total_output_tokens": 610, "total_tokens": 13808, "total_time_consumed": 5.6317620277404785, "step_stats": [{"iteration": 1, "type": "reasoning", "input_tokens": 2340, "output_tokens": 95}, {"iteration": 2, "type": "reasoning", "input_tokens": 2498, "output_tokens": 42}, {"iteration": 3, "type": "reasoning", "input_tokens": 2627, "output_tokens": 33}, {"iteration": 4, "type": "reasoning", "input_tokens": 2659, "output_tokens": 276}, {"iteration": 5, "type": "reasoning", "input_tokens": 3074, "output_tokens": 164}]}
{"question": "Are Trent Edwards and Lucy Saroyan both football players?", "gold_answer": "no", "pred_answer": "No, Trent Edwards is a former American football quarterback, while Lucy Saroyan is an American actress and photographer", "is_correct": false, "collected_titles": ["passage title: Lucy Saroyan", "passage title: Trent Edwards", "passage title: J. Robert Donnelly Husky Heritage Sports Museum", "passage title: Michael Yessis", "passage title: Legally Blonde 2: Red, White &amp; Blonde", "passage title: Williams sisters", "passage title: Eat to Live", "passage title: Can't Take My Eyes Off You", "passage title: On Top of Old Smoky", "passage title: Waltzing Matilda", "passage title: Time Quintet", "passage title: List of companies of India", "passage title: 2012 Hawaii Warriors football team", "passage title: SAIC-GM-Wuling", "passage title: No. 1 Squadron RAAF", "passage title: Chicago Tigers", "passage title: Curve (magazine)"], "collected_passages": ["passage title: Lucy Saroyan\nLucy Saroyan (January 17, 1946 – April 11, 2003) was an American actress and photographer.", "passage title: Trent Edwards\nTrent Addison Edwards (born October 30, 1983) is a former American football quarterback.  He played college football at Stanford and was drafted by the Buffalo Bills in the third round of the 2007 NFL Draft.", "passage title: J. Robert Donnelly Husky Heritage Sports Museum\nThe J. Robert Donnelly Husky Heritage Sports Museum is a public museum located on the University of Connecticut's main campus at Storrs, Connecticut.  The museum documents and celebrates UConn's intercollegiate athletics.  Opening its doors on January 19, 2002, the 2,700-square-foot museum was named in honor of benefactor and 1940 Connecticut basketball and football captain J. Robert (Bob) Donnelly (1971-2005).  Exhibits include national and regional championship trophies, trading cards, photographs, and various sports memorabilia, as well as a six-screen video wall replaying moments of triumph for the UConn Huskies.  A life-size fiberglass sculpture of Jonathan the Husky, UConn's mascot, greets visitors at the museum entrance.  The Connecticut Basketball Rotunda, featuring NCAA championship trophies and life-size cutouts of Ray Allen and Rebecca Lobo, is among the museum's permanent exhibits.", "passage title: Michael Yessis\nMichael Yessis is a teacher, sports performance trainer, biomechanist, and author.  He earned a Ph.D. from the University of Southern California.  He has done work translating, adapting, and implementing sports training methodology from the former Soviet Union, including work by Yuri Verkhoshansky, Anatoliy Bondarchuk, and Vladimir Issurin, for over fifty years.  Yessis has worked extensively with professional and amateur athletes, including Marv Marinovich, Evander Holyfield, Dianne DeNecochea, Jose Luiz Barbosa, and others in over 50 years of active work.  Yessis worked with the Los Angeles Rams and Los Angeles Raiders professional football teams, as well as Team USA Volleyball.  Muscle & Fitness Magazine referred to Yessis as a “legendary biomechanist.”", "passage title: Legally Blonde 2: Red, White &amp; Blonde\nLegally Blonde 2: Red, White & Blonde (also referred to as just Legally Blonde 2) is a 2003 American comedy film directed by Charles Herman-Wurmfeld and written by Kate Kondell.  The sequel to the 2001 film \"Legally Blonde\", the film stars Reese Witherspoon alongside an ensemble cast featuring Sally Field, Regina King, Jennifer Coolidge, Bruce McGill, Dana Ivey, Mary Lynn Rajskub, Bob Newhart, and Luke Wilson, with Coolidge and Wilson reprising their roles from the first film.", "passage title: Williams sisters\nThe Williams sisters are two professional American tennis players: Venus Williams (b. 1980), a seven-time Grand Slam title winner (singles), and Serena Williams (b. 1981), twenty-three-time Grand Slam title winner (singles), both of whom were coached from an early age by their parents Richard Williams and Oracene Price.  There is a noted professional rivalry between them – between the 2001 US Open and the 2017 Australian Open tournaments, they met in nine Grand Slam singles finals.  They became the first two players, female or male, to play in 4 consecutive grand slam singles finals from the 2002 French Open to the 2003 Australian Open; Serena famously won all 4 to complete the first of two \"Serena Slams\".  Between 2000 and 2016, a 17-year span, they collectively won 12 Wimbledon singles titles (Venus won 5 and Serena won 7).  By winning the 2001 Australian Open women's doubles title, they became the 5th pair to complete the Career Doubles Grand Slam and the only pair to complete the Career Doubles Golden Slam.  At the time, Venus and Serena were only 20 and 19 years old, respectively.  Since then they have gone on to add another two Olympic gold medals in the 2008 Beijing Olympics and the 2012 London Olympics.  Nearly a decade later, the duo would go on to win 4 consecutive grand slam doubles titles from 2009 Wimbledon through 2010 Roland Garros, which would catapult them to co-No.  1 doubles players on 7 June 2010.  Two weeks later, on 21 June 2010, Serena would hold the No. 1 singles ranking and Venus would be right behind her at No. 2 in singles.  Their most recent grand slam doubles titles came at the 2012 Wimbledon & 2016 Wimbledon events.  They remain very close, often watching each other's matches in support, even after one of them has been knocked out of a tournament.", "passage title: Eat to Live\nEat to Live: The Amazing Nutrient-Rich Program for Fast and Sustained Weight Loss is a book written in 2003 by Dr. Joel Fuhrman, which he revised in 2011.  The book offers a formula: health = nutrients / calories.", "passage title: Can't Take My Eyes Off You\n\"Can't Take My Eyes Off You\" is a 1967 single credited to Frankie Valli.  The song was among his biggest hits, earning a gold record and reaching No. 2 on the \"Billboard\" Hot 100 for a week, stuck behind \"Windy\" by The Association.  It was co-written by Bob Gaudio, a bandmate of Valli's in The Four Seasons.  It was Valli's biggest solo hit until he hit #1 in 1974 with \"My Eyes Adored You\".", "passage title: On Top of Old Smoky\n\"On Top of Old Smokey\" is a traditional folk song of the United States.  As recorded by The Weavers, the song reached the pop music charts in 1951.  It is catalogued as Roud Folk Song Index No. 414.  In one version the first verse is the following; for more on the words see below.", "passage title: Waltzing Matilda\n\"Waltzing Matilda\" is Australia's best-known bush ballad, and has been described as the country's \"unofficial national anthem\".", "passage title: Time Quintet\nThe Time Quintet is a fantasy/science fiction series of five young adult novels written by Madeleine L'Engle.", "passage title: List of companies of India\nIndia is a country in South Asia.  It is the seventh-largest country by area, the second-most populous country (with over 1.2 billion people), and the most populous democracy in the world.", "passage title: 2012 Hawaii Warriors football team\nThe 2012 Hawaii Warriors football team represented the University of Hawaii at Manoa in the 2012 NCAA Division I FBS football season.  They were led by first-year head coach Norm Chow and played their home games at Aloha Stadium.  They were first year members of the Mountain West Conference.  They finished the season 3–9, 1–7 in Mountain West play to finish in a tie for ninth place.", "passage title: SAIC-GM-Wuling\nSAIC-GM-Wuling Automobile (上汽通用五菱汽车股份有限公司 and abbreviated as SGMW) is a joint venture between SAIC Motor, General Motors, and Liuzhou Wuling Motors Co Ltd. Based in Liuzhou, Guangxi Zhuang Autonomous Region, in southwestern China, it makes commercial and consumer vehicles sold in China under the Wuling and Baojun marques, respectively.  A major mass-volume producer in the Chinese interior, in 2011 SGMW sold 1,286,000 vehicles in China, 1,445,000 in 2012, and aims to sell 2 million cars annually.  Its offerings range in price from US$5,000 to US$10,000.", "passage title: No. 1 Squadron RAAF\nNo. 1 Squadron is a Royal Australian Air Force (RAAF) squadron headquartered at RAAF Base Amberley, Queensland.  Controlled by No. 82 Wing, it is equipped with Boeing F/A-18F Super Hornet multi-role fighters.  The squadron was formed under the Australian Flying Corps in 1916 and saw action in the Sinai and Palestine Campaigns during World War I.  It flew obsolete Royal Aircraft Factory B.E.2s, B.E.12s, Martinsyde G.100s and G.102s, as well as Airco DH.6s, Bristol Scouts and Nieuport 17s, before re-equipping with the R.E.8 in October 1917 and finally the Bristol Fighter in December.  Its commanding officer in 1917–18 was Major Richard Williams, later known as the \"Father of the RAAF\".  Disbanded in 1919, No. 1 Squadron was re-formed on paper as part of the RAAF in 1922, and re-established as an operational unit three years later.", "passage title: Chicago Tigers\nThe Chicago Tigers of the American Professional Football Association (APFA) played only in the first year of the league (1920) and, because of this, have the distinction of being the first NFL team to fold.  They had a record of 2 wins, 5 losses and 1 tie.  The team played its home games at Chicago's Wrigley Field (then called Cubs Park) and was the first NFL team to do so.  The Tigers were never formally members of the APFA.  However, since the team played seven games against APFA teams in 1920, resulting in a 1–5–1 league record, they are generally included in the league standings.", "passage title: Curve (magazine)\nCurve is a lesbian magazine published in the United States.  It covers news, politics, social issues, and includes celebrity interviews and stories on entertainment, pop culture, style, travel, and a website that hosts an internet forum focusing on lesbian issues, active since 2000."], "generated_sentences": ["No, Trent Edwards and Lucy Saroyan are not both football players.", "Here are the answers to the questions:\n\n1.", "1.", "No, Trent Edwards is a former American football quarterback, while Lucy Saroyan is an American actress and photographer."], "model_input": "Wikipedia Title: Nobody Loves You (When You're Down and Out)\n\"Nobody Loves You (When You're Down and Out)\" is a song written by John Lennon released on his 1974 album \"Walls and Bridges\". The song is included on the 1986 compilation \"Menlove Ave.\", the 1990 boxset \"Lennon\", the 1998 boxset \"John Lennon Anthology\", the 2005 two-disc compilation \"\", and the 2010 boxset \"Gimme Some Truth\".\n\nWikipedia Title: John Lennon/Plastic Ono Band\nJohn Lennon/Plastic Ono Band is the debut studio album by English rock musician John Lennon. It was released in 1970, after Lennon had issued three experimental albums with Yoko Ono and \"Live Peace in Toronto 1969\", a live performance in Toronto credited to the Plastic Ono Band. The album was recorded simultaneously with Ono's debut avant garde solo album, \"Yoko Ono/Plastic Ono Band\", at Ascot Sound Studios and Abbey Road Studios using the same musicians and production team and nearly identical cover artwork.\n\nWikipedia Title: Mother (John Lennon song)\n\"Mother\" is a song by English musician John Lennon, first released on his 1970 album \"John Lennon/Plastic Ono Band\". An edited version of the song was issued as a single in the United States on Apple Records, on 28 December 1970. The single runs about 1:41 shorter than the album due to a lack of the tolling bells intro and a quicker fadeout. The B-side features \"Why\" by Yoko Ono. The song peaked in the US at number 19 on the \"Cashbox\" Top 100 and number 43 on the \"Billboard\" Hot 100.\n\nWikipedia Title: Walls and Bridges\nWalls and Bridges is the fifth studio album by English musician John Lennon. It was issued by Apple Records on 26 September 1974 in the United States and on 4 October in the United Kingdom. Written, recorded and released during his 18-month separation from Yoko Ono, the album captured Lennon in the midst of his \"Lost Weekend\". \"Walls and Bridges\" was an American \"Billboard\" number-one album and featured two hit singles, \"Whatever Gets You thru the Night\" and \"#9 Dream\". The first of these was Lennon's first number-one hit in the United States as a solo artist, and his only chart-topping single in either the US or Britain during his lifetime.\n\nQ: Nobody Loves You was written by John Lennon and released on what album that was issued by Apple Records, and was written, recorded, and released during his 18 month separation from Yoko Ono?\nA: The album issued by Apple Records, and written, recorded, and released during John Lennon's 18 month separation from Yoko Ono is Walls and Bridges. Nobody Loves You was written by John Lennon on Walls and Bridges album. So the answer is: Walls and Bridges.\n\n\nWikipedia Title: Route 13 (Laos)\nRoute 13 is the most important highway in the country of Laos. It begins at Boten in the North of Laos at the Chinese border. It connects the city of Vientiane to Luang Prabang in the north and roughly follows the line of the Mekong River down to the border with Cambodia. The road then continues at National Highway 7 in Cambodia. Also this national highway leads past all three international airports in Laos Vientiane Airport, Luang Prabang Airport and Pakse Airport. Between Boten and Nateuy the Route 13 is at a length of 20 km part of the Kunming-Bangkok Expressway, which is also part of the Asian Highway AH3. From Nateuy to Vientiane, the Route 13 is part of the AH12 and from Vientiane to the border of Cambodia AH11.\n\nWikipedia Title: National Route 13 (Vietnam)\nNational Route 13 (Vietnamese: \"Quốc lộ 13\" ) is a highway in southern Vietnam stretching from the northeastern outskirts of Ho Chi Minh City, the commercial centre of the country, towards the border to Cambodia. The highway starts around Thủ Đức on the northern outskirts of Ho Chi Minh City, once the site of the military academy of the Army of the Republic of Vietnam, and travels north through the provinces of Bình Dương and Bình Phước. The highway passes through the districts of Thuận An, Thủ Dầu Một town, Bến Cát, Chơn Thành, Đồng Phú, Bình Long, and Lộc Ninh.\n\nWikipedia Title: Glen Osmond, South Australia\nGlen Osmond is a suburb of Adelaide, South Australia in the City of Burnside which is in the foothills of the Adelaide Hills. It is well known for the road intersection on the western side of the suburb, where the South Eastern Freeway (National Route M1) from the Adelaide Hills and the main route from Melbourne splits into National Route A17 Portrush Road (north, the main route towards Port Adelaide), Glen Osmond Road, Adelaide (northwest towards Adelaide city centre) and state route A3 Cross Road west towards the coast and southern suburbs.\n\nWikipedia Title: Cambodia\nCambodia ( ; Khmer: កម្ពុជា , or Kampuchea ] ), officially known as the Kingdom of Cambodia (Khmer: ព្រះរាជាណាចក្រកម្ពុជា , \"Preăh Réachéanachâk Kâmpŭchéa\", ] ), is a country located in the southern portion of the Indochina Peninsula in Southeast Asia. It is 181035 km2 in area, bordered by Thailand to the northwest, Laos to the northeast, Vietnam to the east, and the Gulf of Thailand to the southwest.\n\nQ: What is known as the Kingdom and has National Route 13 stretching towards its border?\nA: Cambodia is officially known as the Kingdom of Cambodia. National Route 13 streches towards border to Cambodia. So the answer is: Cambodia.\n\n\nWikipedia Title: James Draper (settler)\nJames Draper (1618–1694) was an early settler of the Massachusetts Bay Colony. He was born and married in Heptonstall, Yorkshire, England, and came with his wife to New England shortly after 1647. He was a weaver by profession, and settled in the Massachusetts town of Roxbury, but also lived for a short while in the towns of Dedham and Charlestown. He and his wife had nine children and many notable descendants. They are buried in the Westerly Burial Ground in West Roxbury, now a neighborhood of Boston, and share the oldest marker in the cemetery.\n\nWikipedia Title: Jeremy Theobald\nJeremy Theobald is a British actor best known for his portrayal of \"The Young Man\", the main character in Christopher Nolan's 1998 major picture debut \"Following\", and for which Theobald was also a producer, Filming was scheduled around their day jobs. Jonathan Romney, writing in the \"New Statesman\", noted that \"Nolan and his cast are terrific finds: I wouldn't normally say this to struggling artists, but they might want to give up their day jobs.\"\n\nWikipedia Title: Christopher Nolan\nChristopher Edward Nolan ( ; born 30 July 1970) is an English-American film director, producer, and screenwriter. He is one of the highest-grossing directors in history, and among the most successful and acclaimed filmmakers of the 21st century.\n\nWikipedia Title: Semper Gestion\nSemper is a Swiss wealth management company, asset management and Family Office established in 2001 and working in open architecture. Based in Geneva, with a team of highly skilled portfolio managers who share a common vision of the profession, its model and its values, Semper has a sister company in London (Beauregard Capital Limited) and a representative office in Shanghai (Shanghai Semper). Since 2001, she offers a highly personalized service of wealth management and Family Office. Managed by Grégoire Vaucher (CEO) and Jean-Evrard Dominicé (CIO), Semper currently has 20 employees.\n\nQ: Jeremy Theobald and Christopher Nolan share what profession?\nA: Jeremy Theobald is an actor and producer. Christopher Nolan is a director, producer, and screenwriter. Therefore, they both share the profession of being a producer. So the answer is: producer.\n\n\nWikipedia Title: passage title: Lucy Saroyan\npassage title: Lucy Saroyan\nLucy Saroyan (January 17, 1946 – April 11, 2003) was an American actress and photographer.\n\nWikipedia Title: passage title: Trent Edwards\npassage title: Trent Edwards\nTrent Addison Edwards (born October 30, 1983) is a former American football quarterback.  He played college football at Stanford and was drafted by the Buffalo Bills in the third round of the 2007 NFL Draft.\n\nWikipedia Title: passage title: J. Robert Donnelly Husky Heritage Sports Museum\npassage title: J. Robert Donnelly Husky Heritage Sports Museum\nThe J. Robert Donnelly Husky Heritage Sports Museum is a public museum located on the University of Connecticut's main campus at Storrs, Connecticut.  The museum documents and celebrates UConn's intercollegiate athletics.  Opening its doors on January 19, 2002, the 2,700-square-foot museum was named in honor of benefactor and 1940 Connecticut basketball and football captain J. Robert (Bob) Donnelly (1971-2005).  Exhibits include national and regional championship trophies, trading cards, photographs, and various sports memorabilia, as well as a six-screen video wall replaying moments of triumph for the UConn Huskies.  A life-size fiberglass sculpture of Jonathan the Husky, UConn's mascot, greets visitors at the museum entrance.  The Connecticut Basketball Rotunda, featuring NCAA championship trophies and life-size cutouts of Ray Allen and Rebecca Lobo, is among the museum's permanent exhibits.\n\nWikipedia Title: passage title: Michael Yessis\npassage title: Michael Yessis\nMichael Yessis is a teacher, sports performance trainer, biomechanist, and author.  He earned a Ph.D. from the University of Southern California.  He has done work translating, adapting, and implementing sports training methodology from the former Soviet Union, including work by Yuri Verkhoshansky, Anatoliy Bondarchuk, and Vladimir Issurin, for over fifty years.  Yessis has worked extensively with professional and amateur athletes, including Marv Marinovich, Evander Holyfield, Dianne DeNecochea, Jose Luiz Barbosa, and others in over 50 years of active work.  Yessis worked with the Los Angeles Rams and Los Angeles Raiders professional football teams, as well as Team USA Volleyball.  Muscle & Fitness Magazine referred to Yessis as a “legendary biomechanist.”\n\nWikipedia Title: passage title: Legally Blonde 2: Red, White &amp; Blonde\npassage title: Legally Blonde 2: Red, White &amp; Blonde\nLegally Blonde 2: Red, White & Blonde (also referred to as just Legally Blonde 2) is a 2003 American comedy film directed by Charles Herman-Wurmfeld and written by Kate Kondell.  The sequel to the 2001 film \"Legally Blonde\", the film stars Reese Witherspoon alongside an ensemble cast featuring Sally Field, Regina King, Jennifer Coolidge, Bruce McGill, Dana Ivey, Mary Lynn Rajskub, Bob Newhart, and Luke Wilson, with Coolidge and Wilson reprising their roles from the first film.\n\nWikipedia Title: passage title: Williams sisters\npassage title: Williams sisters\nThe Williams sisters are two professional American tennis players: Venus Williams (b. 1980), a seven-time Grand Slam title winner (singles), and Serena Williams (b. 1981), twenty-three-time Grand Slam title winner (singles), both of whom were coached from an early age by their parents Richard Williams and Oracene Price.  There is a noted professional rivalry between them – between the 2001 US Open and the 2017 Australian Open tournaments, they met in nine Grand Slam singles finals.  They became the first two players, female or male, to play in 4 consecutive grand slam singles finals from the 2002 French Open to the 2003 Australian Open; Serena famously won all 4 to complete the first of two \"Serena Slams\".  Between 2000 and 2016, a 17-year span, they collectively won 12 Wimbledon singles titles (Venus won 5 and Serena won 7).  By winning the 2001 Australian Open women's doubles title, they became the 5th pair to complete the Career Doubles Grand Slam and the only pair to complete the Career Doubles Golden Slam.  At the time, Venus and Serena were only 20 and 19 years old, respectively.  Since then they have gone on to add another two Olympic gold medals in the 2008 Beijing Olympics and the 2012 London Olympics.  Nearly a decade later, the duo would go on to win 4 consecutive grand slam doubles titles from 2009 Wimbledon through 2010 Roland Garros, which would catapult them to co-No.  1 doubles players on 7 June 2010.  Two weeks later, on 21 June 2010, Serena would hold the No. 1 singles ranking and Venus would be right behind her at No. 2 in singles.  Their most recent grand slam doubles titles came at the 2012 Wimbledon & 2016 Wimbledon events.  They remain very close, often watching each other's matches in support, even after one of them has been knocked out of a tournament.\n\nWikipedia Title: passage title: Eat to Live\npassage title: Eat to Live\nEat to Live: The Amazing Nutrient-Rich Program for Fast and Sustained Weight Loss is a book written in 2003 by Dr. Joel Fuhrman, which he revised in 2011.  The book offers a formula: health = nutrients / calories.\n\nWikipedia Title: passage title: Can't Take My Eyes Off You\npassage title: Can't Take My Eyes Off You\n\"Can't Take My Eyes Off You\" is a 1967 single credited to Frankie Valli.  The song was among his biggest hits, earning a gold record and reaching No. 2 on the \"Billboard\" Hot 100 for a week, stuck behind \"Windy\" by The Association.  It was co-written by Bob Gaudio, a bandmate of Valli's in The Four Seasons.  It was Valli's biggest solo hit until he hit #1 in 1974 with \"My Eyes Adored You\".\n\nWikipedia Title: passage title: On Top of Old Smoky\npassage title: On Top of Old Smoky\n\"On Top of Old Smokey\" is a traditional folk song of the United States.  As recorded by The Weavers, the song reached the pop music charts in 1951.  It is catalogued as Roud Folk Song Index No. 414.  In one version the first verse is the following; for more on the words see below.\n\nWikipedia Title: passage title: Waltzing Matilda\npassage title: Waltzing Matilda\n\"Waltzing Matilda\" is Australia's best-known bush ballad, and has been described as the country's \"unofficial national anthem\".\n\nWikipedia Title: passage title: Time Quintet\npassage title: Time Quintet\nThe Time Quintet is a fantasy/science fiction series of five young adult novels written by Madeleine L'Engle.\n\nWikipedia Title: passage title: List of companies of India\npassage title: List of companies of India\nIndia is a country in South Asia.  It is the seventh-largest country by area, the second-most populous country (with over 1.2 billion people), and the most populous democracy in the world.\n\nWikipedia Title: passage title: 2012 Hawaii Warriors football team\npassage title: 2012 Hawaii Warriors football team\nThe 2012 Hawaii Warriors football team represented the University of Hawaii at Manoa in the 2012 NCAA Division I FBS football season.  They were led by first-year head coach Norm Chow and played their home games at Aloha Stadium.  They were first year members of the Mountain West Conference.  They finished the season 3–9, 1–7 in Mountain West play to finish in a tie for ninth place.\n\nWikipedia Title: passage title: SAIC-GM-Wuling\npassage title: SAIC-GM-Wuling\nSAIC-GM-Wuling Automobile (上汽通用五菱汽车股份有限公司 and abbreviated as SGMW) is a joint venture between SAIC Motor, General Motors, and Liuzhou Wuling Motors Co Ltd. Based in Liuzhou, Guangxi Zhuang Autonomous Region, in southwestern China, it makes commercial and consumer vehicles sold in China under the Wuling and Baojun marques, respectively.  A major mass-volume producer in the Chinese interior, in 2011 SGMW sold 1,286,000 vehicles in China, 1,445,000 in 2012, and aims to sell 2 million cars annually.  Its offerings range in price from US$5,000 to US$10,000.\n\nWikipedia Title: passage title: No. 1 Squadron RAAF\npassage title: No. 1 Squadron RAAF\nNo. 1 Squadron is a Royal Australian Air Force (RAAF) squadron headquartered at RAAF Base Amberley, Queensland.  Controlled by No. 82 Wing, it is equipped with Boeing F/A-18F Super Hornet multi-role fighters.  The squadron was formed under the Australian Flying Corps in 1916 and saw action in the Sinai and Palestine Campaigns during World War I.  It flew obsolete Royal Aircraft Factory B.E.2s, B.E.12s, Martinsyde G.100s and G.102s, as well as Airco DH.6s, Bristol Scouts and Nieuport 17s, before re-equipping with the R.E.8 in October 1917 and finally the Bristol Fighter in December.  Its commanding officer in 1917–18 was Major Richard Williams, later known as the \"Father of the RAAF\".  Disbanded in 1919, No. 1 Squadron was re-formed on paper as part of the RAAF in 1922, and re-established as an operational unit three years later.\n\nWikipedia Title: passage title: Chicago Tigers\npassage title: Chicago Tigers\nThe Chicago Tigers of the American Professional Football Association (APFA) played only in the first year of the league (1920) and, because of this, have the distinction of being the first NFL team to fold.  They had a record of 2 wins, 5 losses and 1 tie.  The team played its home games at Chicago's Wrigley Field (then called Cubs Park) and was the first NFL team to do so.  The Tigers were never formally members of the APFA.  However, since the team played seven games against APFA teams in 1920, resulting in a 1–5–1 league record, they are generally included in the league standings.\n\nWikipedia Title: passage title: Curve (magazine)\npassage title: Curve (magazine)\nCurve is a lesbian magazine published in the United States.  It covers news, politics, social issues, and includes celebrity interviews and stories on entertainment, pop culture, style, travel, and a website that hosts an internet forum focusing on lesbian issues, active since 2000.\n\nQ: Are Trent Edwards and Lucy Saroyan both football players?\nA: No, Trent Edwards and Lucy Saroyan are not both football players. Here are the answers to the questions:\n\n1. 1. No, Trent Edwards is a former American football quarterback, while Lucy Saroyan is an American actress and photographer.", "model_response": "Here are the answers to the questions:\n\n1. Q: Nobody Loves You was written by John Lennon and released on what album that was issued by Apple Records, and was written, recorded, and released during his 18 month separation from Yoko Ono?\nA: The album issued by Apple Records, and written, recorded, and released during John Lennon's 18 month separation from Yoko Ono is Walls and Bridges.\n\n2. Q: What is known as the Kingdom and has National Route 13 stretching towards its border?\nA: Cambodia is officially known as the Kingdom of Cambodia. National Route 13 stretches towards the border to Cambodia.\n\n3. Q: Jeremy Theobald and Christopher Nolan share what profession?\nA: Jeremy Theobald is an actor and producer. Christopher Nolan is a director, producer, and screenwriter. Therefore, they both share the profession of being a producer.\n\n4. Q: Are Trent Edwards and Lucy Saroyan both football players?\nA: No, Trent Edwards is a former American football quarterback, while Lucy Saroyan is an American actress and photographer.", "total_input_tokens": 17356, "total_output_tokens": 2528, "total_tokens": 19884, "total_time_consumed": 22.767226696014404, "step_stats": [{"iteration": 1, "type": "reasoning", "input_tokens": 2523, "output_tokens": 37}, {"iteration": 2, "type": "reasoning", "input_tokens": 2985, "output_tokens": 215}, {"iteration": 3, "type": "reasoning", "input_tokens": 3400, "output_tokens": 2022}, {"iteration": 4, "type": "reasoning", "input_tokens": 4174, "output_tokens": 31}, {"iteration": 5, "type": "reasoning", "input_tokens": 4274, "output_tokens": 223}]}
{"question": "Are University of Virginia and Massachusetts Institute of Technology in the same country?", "gold_answer": "yes", "pred_answer": "1", "is_correct": false, "collected_titles": ["passage title: University of Virginia", "passage title: Massachusetts Institute of Technology", "passage title: Doctor of Philosophy", "passage title: Flexible solar cell research", "passage title: Carnegie Mellon University", "passage title: List of current United States first spouses", "passage title: Von Braun Center for Science &amp; Innovation", "passage title: Eat to Live", "passage title: Can't Take My Eyes Off You", "passage title: On Top of Old Smoky", "passage title: Waltzing Matilda", "passage title: Time Quintet", "passage title: List of companies of India", "passage title: 2012 Hawaii Warriors football team", "passage title: SAIC-GM-Wuling", "passage title: No. 1 Squadron RAAF", "passage title: Chicago Tigers"], "collected_passages": ["passage title: University of Virginia\nThe University of Virginia (U.Va.  or UVA), frequently referred to simply as Virginia, is a public research university and the flagship for the Commonwealth of Virginia.  Founded in 1819 by Declaration of Independence author Thomas Jefferson, UVA is known for its historic foundations, student-run honor code, and secret societies.", "passage title: Massachusetts Institute of Technology\nThe Massachusetts Institute of Technology (MIT) is a private research university in Cambridge, Massachusetts.  It is often ranked as one of the world's most prestigious universities.", "passage title: Doctor of Philosophy\nA Doctor of Philosophy (PhD, Ph.D., or DPhil; Latin \"Philosophiae Doctor \") is the highest academic degree awarded by universities in most countries.  Ph.D.s are awarded for programs across the whole breadth of academic fields.  The completion of a Ph.D. is often a requirement for employment as a university professor, researcher, or scientist in many fields.  Individuals who have earned a Doctor of Philosophy degree may, in most jurisdictions, use the title of \"Doctor\" (often abbreviated \"Dr\") or, in non-English speaking countries, variants such as \"Dr. phil.\"  with their name, and may use post-nominal letters such as \"Ph.D.\", \"PhD\" or \"DPhil\" (depending on the awarding institute).", "passage title: Flexible solar cell research\nFlexible solar cell research is a research-level technology, an example of which was created at the Massachusetts Institute of Technology in which solar cells are manufactured by depositing photovoltaic material on flexible substrates, such as ordinary paper, using chemical vapor deposition technology.  The technology for manufacturing solar cells on paper was developed by a group of researchers from the Massachusetts Institute of Technology with support from the National Science Foundation and the Eni-MIT Alliance Solar Frontiers Program.", "passage title: Carnegie Mellon University\nCarnegie Mellon University (Carnegie Mellon or CMU or ) is a private research university in Pittsburgh, Pennsylvania.", "passage title: List of current United States first spouses\nIn the United States, the first spouse (first lady for women, first gentleman for men) is the term used to refer to the spouse of a chief executive - that is, of the spouse of the President of the United States (the First Lady of the United States and the First Gentleman of the United States) and the spouses of the governors of the 50 U.S. states and U.S. territories (Guam, Northern Mariana Islands, Puerto Rico, American Samoa, and the United States Virgin Islands) and the spouse of the mayor of the District of Columbia.  (The spouses of many mayors are often called the \"first lady\" or \"first gentleman\" of the city as well, and the use of the terms sometimes extends even to the spouses of college presidents).", "passage title: Von Braun Center for Science &amp; Innovation\nThe Von Braun Center for Science & Innovation (VCSI ) is a non-profit research and development organization based in Huntsville, Alabama and is named for pioneering aerospace engineer Wernher von Braun.  VCSI is affiliated with NASA, Department of Defense and other federal government agencies.", "passage title: Eat to Live\nEat to Live: The Amazing Nutrient-Rich Program for Fast and Sustained Weight Loss is a book written in 2003 by Dr. Joel Fuhrman, which he revised in 2011.  The book offers a formula: health = nutrients / calories.", "passage title: Can't Take My Eyes Off You\n\"Can't Take My Eyes Off You\" is a 1967 single credited to Frankie Valli.  The song was among his biggest hits, earning a gold record and reaching No. 2 on the \"Billboard\" Hot 100 for a week, stuck behind \"Windy\" by The Association.  It was co-written by Bob Gaudio, a bandmate of Valli's in The Four Seasons.  It was Valli's biggest solo hit until he hit #1 in 1974 with \"My Eyes Adored You\".", "passage title: On Top of Old Smoky\n\"On Top of Old Smokey\" is a traditional folk song of the United States.  As recorded by The Weavers, the song reached the pop music charts in 1951.  It is catalogued as Roud Folk Song Index No. 414.  In one version the first verse is the following; for more on the words see below.", "passage title: Waltzing Matilda\n\"Waltzing Matilda\" is Australia's best-known bush ballad, and has been described as the country's \"unofficial national anthem\".", "passage title: Time Quintet\nThe Time Quintet is a fantasy/science fiction series of five young adult novels written by Madeleine L'Engle.", "passage title: List of companies of India\nIndia is a country in South Asia.  It is the seventh-largest country by area, the second-most populous country (with over 1.2 billion people), and the most populous democracy in the world.", "passage title: 2012 Hawaii Warriors football team\nThe 2012 Hawaii Warriors football team represented the University of Hawaii at Manoa in the 2012 NCAA Division I FBS football season.  They were led by first-year head coach Norm Chow and played their home games at Aloha Stadium.  They were first year members of the Mountain West Conference.  They finished the season 3–9, 1–7 in Mountain West play to finish in a tie for ninth place.", "passage title: SAIC-GM-Wuling\nSAIC-GM-Wuling Automobile (上汽通用五菱汽车股份有限公司 and abbreviated as SGMW) is a joint venture between SAIC Motor, General Motors, and Liuzhou Wuling Motors Co Ltd. Based in Liuzhou, Guangxi Zhuang Autonomous Region, in southwestern China, it makes commercial and consumer vehicles sold in China under the Wuling and Baojun marques, respectively.  A major mass-volume producer in the Chinese interior, in 2011 SGMW sold 1,286,000 vehicles in China, 1,445,000 in 2012, and aims to sell 2 million cars annually.  Its offerings range in price from US$5,000 to US$10,000.", "passage title: No. 1 Squadron RAAF\nNo. 1 Squadron is a Royal Australian Air Force (RAAF) squadron headquartered at RAAF Base Amberley, Queensland.  Controlled by No. 82 Wing, it is equipped with Boeing F/A-18F Super Hornet multi-role fighters.  The squadron was formed under the Australian Flying Corps in 1916 and saw action in the Sinai and Palestine Campaigns during World War I.  It flew obsolete Royal Aircraft Factory B.E.2s, B.E.12s, Martinsyde G.100s and G.102s, as well as Airco DH.6s, Bristol Scouts and Nieuport 17s, before re-equipping with the R.E.8 in October 1917 and finally the Bristol Fighter in December.  Its commanding officer in 1917–18 was Major Richard Williams, later known as the \"Father of the RAAF\".  Disbanded in 1919, No. 1 Squadron was re-formed on paper as part of the RAAF in 1922, and re-established as an operational unit three years later.", "passage title: Chicago Tigers\nThe Chicago Tigers of the American Professional Football Association (APFA) played only in the first year of the league (1920) and, because of this, have the distinction of being the first NFL team to fold.  They had a record of 2 wins, 5 losses and 1 tie.  The team played its home games at Chicago's Wrigley Field (then called Cubs Park) and was the first NFL team to do so.  The Tigers were never formally members of the APFA.  However, since the team played seven games against APFA teams in 1920, resulting in a 1–5–1 league record, they are generally included in the league standings."], "generated_sentences": ["The University of Virginia and the Massachusetts Institute of Technology (MIT) are both located in the United States.", "Here are the answers to the questions:\n\n1.", "1."], "model_input": "Wikipedia Title: Nobody Loves You (When You're Down and Out)\n\"Nobody Loves You (When You're Down and Out)\" is a song written by John Lennon released on his 1974 album \"Walls and Bridges\". The song is included on the 1986 compilation \"Menlove Ave.\", the 1990 boxset \"Lennon\", the 1998 boxset \"John Lennon Anthology\", the 2005 two-disc compilation \"\", and the 2010 boxset \"Gimme Some Truth\".\n\nWikipedia Title: John Lennon/Plastic Ono Band\nJohn Lennon/Plastic Ono Band is the debut studio album by English rock musician John Lennon. It was released in 1970, after Lennon had issued three experimental albums with Yoko Ono and \"Live Peace in Toronto 1969\", a live performance in Toronto credited to the Plastic Ono Band. The album was recorded simultaneously with Ono's debut avant garde solo album, \"Yoko Ono/Plastic Ono Band\", at Ascot Sound Studios and Abbey Road Studios using the same musicians and production team and nearly identical cover artwork.\n\nWikipedia Title: Mother (John Lennon song)\n\"Mother\" is a song by English musician John Lennon, first released on his 1970 album \"John Lennon/Plastic Ono Band\". An edited version of the song was issued as a single in the United States on Apple Records, on 28 December 1970. The single runs about 1:41 shorter than the album due to a lack of the tolling bells intro and a quicker fadeout. The B-side features \"Why\" by Yoko Ono. The song peaked in the US at number 19 on the \"Cashbox\" Top 100 and number 43 on the \"Billboard\" Hot 100.\n\nWikipedia Title: Walls and Bridges\nWalls and Bridges is the fifth studio album by English musician John Lennon. It was issued by Apple Records on 26 September 1974 in the United States and on 4 October in the United Kingdom. Written, recorded and released during his 18-month separation from Yoko Ono, the album captured Lennon in the midst of his \"Lost Weekend\". \"Walls and Bridges\" was an American \"Billboard\" number-one album and featured two hit singles, \"Whatever Gets You thru the Night\" and \"#9 Dream\". The first of these was Lennon's first number-one hit in the United States as a solo artist, and his only chart-topping single in either the US or Britain during his lifetime.\n\nQ: Nobody Loves You was written by John Lennon and released on what album that was issued by Apple Records, and was written, recorded, and released during his 18 month separation from Yoko Ono?\nA: The album issued by Apple Records, and written, recorded, and released during John Lennon's 18 month separation from Yoko Ono is Walls and Bridges. Nobody Loves You was written by John Lennon on Walls and Bridges album. So the answer is: Walls and Bridges.\n\n\nWikipedia Title: Route 13 (Laos)\nRoute 13 is the most important highway in the country of Laos. It begins at Boten in the North of Laos at the Chinese border. It connects the city of Vientiane to Luang Prabang in the north and roughly follows the line of the Mekong River down to the border with Cambodia. The road then continues at National Highway 7 in Cambodia. Also this national highway leads past all three international airports in Laos Vientiane Airport, Luang Prabang Airport and Pakse Airport. Between Boten and Nateuy the Route 13 is at a length of 20 km part of the Kunming-Bangkok Expressway, which is also part of the Asian Highway AH3. From Nateuy to Vientiane, the Route 13 is part of the AH12 and from Vientiane to the border of Cambodia AH11.\n\nWikipedia Title: National Route 13 (Vietnam)\nNational Route 13 (Vietnamese: \"Quốc lộ 13\" ) is a highway in southern Vietnam stretching from the northeastern outskirts of Ho Chi Minh City, the commercial centre of the country, towards the border to Cambodia. The highway starts around Thủ Đức on the northern outskirts of Ho Chi Minh City, once the site of the military academy of the Army of the Republic of Vietnam, and travels north through the provinces of Bình Dương and Bình Phước. The highway passes through the districts of Thuận An, Thủ Dầu Một town, Bến Cát, Chơn Thành, Đồng Phú, Bình Long, and Lộc Ninh.\n\nWikipedia Title: Glen Osmond, South Australia\nGlen Osmond is a suburb of Adelaide, South Australia in the City of Burnside which is in the foothills of the Adelaide Hills. It is well known for the road intersection on the western side of the suburb, where the South Eastern Freeway (National Route M1) from the Adelaide Hills and the main route from Melbourne splits into National Route A17 Portrush Road (north, the main route towards Port Adelaide), Glen Osmond Road, Adelaide (northwest towards Adelaide city centre) and state route A3 Cross Road west towards the coast and southern suburbs.\n\nWikipedia Title: Cambodia\nCambodia ( ; Khmer: កម្ពុជា , or Kampuchea ] ), officially known as the Kingdom of Cambodia (Khmer: ព្រះរាជាណាចក្រកម្ពុជា , \"Preăh Réachéanachâk Kâmpŭchéa\", ] ), is a country located in the southern portion of the Indochina Peninsula in Southeast Asia. It is 181035 km2 in area, bordered by Thailand to the northwest, Laos to the northeast, Vietnam to the east, and the Gulf of Thailand to the southwest.\n\nQ: What is known as the Kingdom and has National Route 13 stretching towards its border?\nA: Cambodia is officially known as the Kingdom of Cambodia. National Route 13 streches towards border to Cambodia. So the answer is: Cambodia.\n\n\nWikipedia Title: James Draper (settler)\nJames Draper (1618–1694) was an early settler of the Massachusetts Bay Colony. He was born and married in Heptonstall, Yorkshire, England, and came with his wife to New England shortly after 1647. He was a weaver by profession, and settled in the Massachusetts town of Roxbury, but also lived for a short while in the towns of Dedham and Charlestown. He and his wife had nine children and many notable descendants. They are buried in the Westerly Burial Ground in West Roxbury, now a neighborhood of Boston, and share the oldest marker in the cemetery.\n\nWikipedia Title: Jeremy Theobald\nJeremy Theobald is a British actor best known for his portrayal of \"The Young Man\", the main character in Christopher Nolan's 1998 major picture debut \"Following\", and for which Theobald was also a producer, Filming was scheduled around their day jobs. Jonathan Romney, writing in the \"New Statesman\", noted that \"Nolan and his cast are terrific finds: I wouldn't normally say this to struggling artists, but they might want to give up their day jobs.\"\n\nWikipedia Title: Christopher Nolan\nChristopher Edward Nolan ( ; born 30 July 1970) is an English-American film director, producer, and screenwriter. He is one of the highest-grossing directors in history, and among the most successful and acclaimed filmmakers of the 21st century.\n\nWikipedia Title: Semper Gestion\nSemper is a Swiss wealth management company, asset management and Family Office established in 2001 and working in open architecture. Based in Geneva, with a team of highly skilled portfolio managers who share a common vision of the profession, its model and its values, Semper has a sister company in London (Beauregard Capital Limited) and a representative office in Shanghai (Shanghai Semper). Since 2001, she offers a highly personalized service of wealth management and Family Office. Managed by Grégoire Vaucher (CEO) and Jean-Evrard Dominicé (CIO), Semper currently has 20 employees.\n\nQ: Jeremy Theobald and Christopher Nolan share what profession?\nA: Jeremy Theobald is an actor and producer. Christopher Nolan is a director, producer, and screenwriter. Therefore, they both share the profession of being a producer. So the answer is: producer.\n\n\nWikipedia Title: passage title: University of Virginia\npassage title: University of Virginia\nThe University of Virginia (U.Va.  or UVA), frequently referred to simply as Virginia, is a public research university and the flagship for the Commonwealth of Virginia.  Founded in 1819 by Declaration of Independence author Thomas Jefferson, UVA is known for its historic foundations, student-run honor code, and secret societies.\n\nWikipedia Title: passage title: Massachusetts Institute of Technology\npassage title: Massachusetts Institute of Technology\nThe Massachusetts Institute of Technology (MIT) is a private research university in Cambridge, Massachusetts.  It is often ranked as one of the world's most prestigious universities.\n\nWikipedia Title: passage title: Doctor of Philosophy\npassage title: Doctor of Philosophy\nA Doctor of Philosophy (PhD, Ph.D., or DPhil; Latin \"Philosophiae Doctor \") is the highest academic degree awarded by universities in most countries.  Ph.D.s are awarded for programs across the whole breadth of academic fields.  The completion of a Ph.D. is often a requirement for employment as a university professor, researcher, or scientist in many fields.  Individuals who have earned a Doctor of Philosophy degree may, in most jurisdictions, use the title of \"Doctor\" (often abbreviated \"Dr\") or, in non-English speaking countries, variants such as \"Dr. phil.\"  with their name, and may use post-nominal letters such as \"Ph.D.\", \"PhD\" or \"DPhil\" (depending on the awarding institute).\n\nWikipedia Title: passage title: Flexible solar cell research\npassage title: Flexible solar cell research\nFlexible solar cell research is a research-level technology, an example of which was created at the Massachusetts Institute of Technology in which solar cells are manufactured by depositing photovoltaic material on flexible substrates, such as ordinary paper, using chemical vapor deposition technology.  The technology for manufacturing solar cells on paper was developed by a group of researchers from the Massachusetts Institute of Technology with support from the National Science Foundation and the Eni-MIT Alliance Solar Frontiers Program.\n\nWikipedia Title: passage title: Carnegie Mellon University\npassage title: Carnegie Mellon University\nCarnegie Mellon University (Carnegie Mellon or CMU or ) is a private research university in Pittsburgh, Pennsylvania.\n\nWikipedia Title: passage title: List of current United States first spouses\npassage title: List of current United States first spouses\nIn the United States, the first spouse (first lady for women, first gentleman for men) is the term used to refer to the spouse of a chief executive - that is, of the spouse of the President of the United States (the First Lady of the United States and the First Gentleman of the United States) and the spouses of the governors of the 50 U.S. states and U.S. territories (Guam, Northern Mariana Islands, Puerto Rico, American Samoa, and the United States Virgin Islands) and the spouse of the mayor of the District of Columbia.  (The spouses of many mayors are often called the \"first lady\" or \"first gentleman\" of the city as well, and the use of the terms sometimes extends even to the spouses of college presidents).\n\nWikipedia Title: passage title: Von Braun Center for Science &amp; Innovation\npassage title: Von Braun Center for Science &amp; Innovation\nThe Von Braun Center for Science & Innovation (VCSI ) is a non-profit research and development organization based in Huntsville, Alabama and is named for pioneering aerospace engineer Wernher von Braun.  VCSI is affiliated with NASA, Department of Defense and other federal government agencies.\n\nWikipedia Title: passage title: Eat to Live\npassage title: Eat to Live\nEat to Live: The Amazing Nutrient-Rich Program for Fast and Sustained Weight Loss is a book written in 2003 by Dr. Joel Fuhrman, which he revised in 2011.  The book offers a formula: health = nutrients / calories.\n\nWikipedia Title: passage title: Can't Take My Eyes Off You\npassage title: Can't Take My Eyes Off You\n\"Can't Take My Eyes Off You\" is a 1967 single credited to Frankie Valli.  The song was among his biggest hits, earning a gold record and reaching No. 2 on the \"Billboard\" Hot 100 for a week, stuck behind \"Windy\" by The Association.  It was co-written by Bob Gaudio, a bandmate of Valli's in The Four Seasons.  It was Valli's biggest solo hit until he hit #1 in 1974 with \"My Eyes Adored You\".\n\nWikipedia Title: passage title: On Top of Old Smoky\npassage title: On Top of Old Smoky\n\"On Top of Old Smokey\" is a traditional folk song of the United States.  As recorded by The Weavers, the song reached the pop music charts in 1951.  It is catalogued as Roud Folk Song Index No. 414.  In one version the first verse is the following; for more on the words see below.\n\nWikipedia Title: passage title: Waltzing Matilda\npassage title: Waltzing Matilda\n\"Waltzing Matilda\" is Australia's best-known bush ballad, and has been described as the country's \"unofficial national anthem\".\n\nWikipedia Title: passage title: Time Quintet\npassage title: Time Quintet\nThe Time Quintet is a fantasy/science fiction series of five young adult novels written by Madeleine L'Engle.\n\nWikipedia Title: passage title: List of companies of India\npassage title: List of companies of India\nIndia is a country in South Asia.  It is the seventh-largest country by area, the second-most populous country (with over 1.2 billion people), and the most populous democracy in the world.\n\nWikipedia Title: passage title: 2012 Hawaii Warriors football team\npassage title: 2012 Hawaii Warriors football team\nThe 2012 Hawaii Warriors football team represented the University of Hawaii at Manoa in the 2012 NCAA Division I FBS football season.  They were led by first-year head coach Norm Chow and played their home games at Aloha Stadium.  They were first year members of the Mountain West Conference.  They finished the season 3–9, 1–7 in Mountain West play to finish in a tie for ninth place.\n\nWikipedia Title: passage title: SAIC-GM-Wuling\npassage title: SAIC-GM-Wuling\nSAIC-GM-Wuling Automobile (上汽通用五菱汽车股份有限公司 and abbreviated as SGMW) is a joint venture between SAIC Motor, General Motors, and Liuzhou Wuling Motors Co Ltd. Based in Liuzhou, Guangxi Zhuang Autonomous Region, in southwestern China, it makes commercial and consumer vehicles sold in China under the Wuling and Baojun marques, respectively.  A major mass-volume producer in the Chinese interior, in 2011 SGMW sold 1,286,000 vehicles in China, 1,445,000 in 2012, and aims to sell 2 million cars annually.  Its offerings range in price from US$5,000 to US$10,000.\n\nWikipedia Title: passage title: No. 1 Squadron RAAF\npassage title: No. 1 Squadron RAAF\nNo. 1 Squadron is a Royal Australian Air Force (RAAF) squadron headquartered at RAAF Base Amberley, Queensland.  Controlled by No. 82 Wing, it is equipped with Boeing F/A-18F Super Hornet multi-role fighters.  The squadron was formed under the Australian Flying Corps in 1916 and saw action in the Sinai and Palestine Campaigns during World War I.  It flew obsolete Royal Aircraft Factory B.E.2s, B.E.12s, Martinsyde G.100s and G.102s, as well as Airco DH.6s, Bristol Scouts and Nieuport 17s, before re-equipping with the R.E.8 in October 1917 and finally the Bristol Fighter in December.  Its commanding officer in 1917–18 was Major Richard Williams, later known as the \"Father of the RAAF\".  Disbanded in 1919, No. 1 Squadron was re-formed on paper as part of the RAAF in 1922, and re-established as an operational unit three years later.\n\nWikipedia Title: passage title: Chicago Tigers\npassage title: Chicago Tigers\nThe Chicago Tigers of the American Professional Football Association (APFA) played only in the first year of the league (1920) and, because of this, have the distinction of being the first NFL team to fold.  They had a record of 2 wins, 5 losses and 1 tie.  The team played its home games at Chicago's Wrigley Field (then called Cubs Park) and was the first NFL team to do so.  The Tigers were never formally members of the APFA.  However, since the team played seven games against APFA teams in 1920, resulting in a 1–5–1 league record, they are generally included in the league standings.\n\nQ: Are University of Virginia and Massachusetts Institute of Technology in the same country?\nA: The University of Virginia and the Massachusetts Institute of Technology (MIT) are both located in the United States. Here are the answers to the questions:\n\n1. 1.", "model_response": "The University of Virginia and the Massachusetts Institute of Technology (MIT) are both located in the United States.", "total_input_tokens": 15488, "total_output_tokens": 342, "total_tokens": 15830, "total_time_consumed": 3.2830810546875, "step_stats": [{"iteration": 1, "type": "reasoning", "input_tokens": 2303, "output_tokens": 22}, {"iteration": 2, "type": "reasoning", "input_tokens": 2598, "output_tokens": 260}, {"iteration": 3, "type": "reasoning", "input_tokens": 3013, "output_tokens": 16}, {"iteration": 4, "type": "reasoning", "input_tokens": 3787, "output_tokens": 22}, {"iteration": 5, "type": "reasoning", "input_tokens": 3787, "output_tokens": 22}]}
{"question": "Which famous mine was in service first, the Salmita Mine or the Kanichee Mine?", "gold_answer": "Kanichee Mine", "pred_answer": "The Kanichee Mine was in operation from as early as 1910, while the Salmita Mine was first discovered in 1945 and entered production in 1983", "is_correct": false, "collected_titles": ["passage title: Kanichee Mine", "passage title: Salmita Mine", "passage title: Nova Lima", "passage title: San Manuel Copper Mine", "passage title: Mao-4 moored mine", "passage title: Burra Burra Mine (Tennessee)"], "collected_passages": ["passage title: Kanichee Mine\nThe Kanichee Mine, also less commonly known as the Ajax Mine, is an abandoned base metal and precious metal mine, located in the Temagami region of northeastern Ontario, Canada.  It is near the small unincorporated community of Temagami North, accessed by the Kanichee Mine Road from Highway 11.  The Kanichee Mine zone has been explored and mined discontinuously from as early as 1910.  During the 20th century, it operated and closed down at least three times, with the most recent being from 1973 to 1976.  To date, the discontinuous operation of Kanichee Mine has produced 4.2 million pounds of metal.", "passage title: Salmita Mine\nThe Salmita Mine was a gold producer in the Northwest Territories, Canada during 1983 to 1987.  The deposit was first discovered in 1945 and underground exploration was carried out in 1951-1952.  It was reactivated for exploration by Giant Yellowknife Mines Limited in 1975 and entered production in 1983.  They used the old camp and milling plant of the abandoned Tundra Mine, located a few kilometres to the south.  The mine produced 179,906 troy ounces (5596 kg) of gold from the milling of 238,177 tons of ore.", "passage title: Nova Lima\nNova Lima is a municipality of about 87,000 people, whose downtown is located about 20 kilometers of Belo Horizonte, the capital of the south-eastern Brazilian state of Minas Gerais.  Mining is one of the main economical activities of the city, including the extraction of Iron Ore and Gold.  The most famous mine in the city is Morro Velho (Old Hill), a gold mine of 2700 m depth.", "passage title: San Manuel Copper Mine\nThe San Manuel Copper Mine was a surface and underground porphyry copper mine located in San Manuel, Pinal County, Arizona.  Frank Schultz was the original discoverer, in 1879, but the main body of the deposits were discovered by Henry W. Nichols in 1942.  The exploration drilling went on from 1943 to 1948, with the first mine shaft built 1948.  Louis Lesser developed a mining city to service Nichols’ newly discovered deposits, and the development was completed about 1954.  The first major production began in 1955, and the mine and smelter were permanently closed in 2003.", "passage title: Mao-4 moored mine\nMoored-4 (锚-4, Mao-4) moored mine developed by Fengxi Machinery Factory (汾西机器厂) was accepted into service in November 1973, and it is the first moored mine in the Chinese service that incorporates acoustic fuse.  The mine can be planted by both the surface ships and submarines from depth of 20–200 meters, and it weighs 600 kg.  The mine has an effective radius of 20 meters and effective life of 2 years.  The original Moored-4 was upgraded to Moored-4-I (锚-4甲, Mao-4-Jia) standard in November 1982, and subsequently upgraded into Moored-4-II (锚-4乙, Mao-4-Yi) standard by December 1985.  In comparison to earlier versions, the latest version adopted large scale integrated circuits.", "passage title: Burra Burra Mine (Tennessee)\nThe Burra Burra Mine is a copper mine located in Ducktown, Tennessee, in the southeastern United States.  Named for the famous mine in Australia, the Burra Burra Mine extracted over 15 million tons (14 million metric tons) of copper ore during its 60 years of operation between 1899 and 1959.  The mine's remaining structures are listed on the National Register of Historic Places as part of the Burra Burra Mine Historic District.  The site is also home to the Ducktown Basin Museum, and the museum and mine are a Tennessee State Historic Site operated in partnership with the Tennessee Historical Commission."], "generated_sentences": ["The Kanichee Mine was in operation from as early as 1910, while the Salmita Mine was first discovered in 1945 and entered production in 1983."], "model_input": "Wikipedia Title: Nobody Loves You (When You're Down and Out)\n\"Nobody Loves You (When You're Down and Out)\" is a song written by John Lennon released on his 1974 album \"Walls and Bridges\". The song is included on the 1986 compilation \"Menlove Ave.\", the 1990 boxset \"Lennon\", the 1998 boxset \"John Lennon Anthology\", the 2005 two-disc compilation \"\", and the 2010 boxset \"Gimme Some Truth\".\n\nWikipedia Title: John Lennon/Plastic Ono Band\nJohn Lennon/Plastic Ono Band is the debut studio album by English rock musician John Lennon. It was released in 1970, after Lennon had issued three experimental albums with Yoko Ono and \"Live Peace in Toronto 1969\", a live performance in Toronto credited to the Plastic Ono Band. The album was recorded simultaneously with Ono's debut avant garde solo album, \"Yoko Ono/Plastic Ono Band\", at Ascot Sound Studios and Abbey Road Studios using the same musicians and production team and nearly identical cover artwork.\n\nWikipedia Title: Mother (John Lennon song)\n\"Mother\" is a song by English musician John Lennon, first released on his 1970 album \"John Lennon/Plastic Ono Band\". An edited version of the song was issued as a single in the United States on Apple Records, on 28 December 1970. The single runs about 1:41 shorter than the album due to a lack of the tolling bells intro and a quicker fadeout. The B-side features \"Why\" by Yoko Ono. The song peaked in the US at number 19 on the \"Cashbox\" Top 100 and number 43 on the \"Billboard\" Hot 100.\n\nWikipedia Title: Walls and Bridges\nWalls and Bridges is the fifth studio album by English musician John Lennon. It was issued by Apple Records on 26 September 1974 in the United States and on 4 October in the United Kingdom. Written, recorded and released during his 18-month separation from Yoko Ono, the album captured Lennon in the midst of his \"Lost Weekend\". \"Walls and Bridges\" was an American \"Billboard\" number-one album and featured two hit singles, \"Whatever Gets You thru the Night\" and \"#9 Dream\". The first of these was Lennon's first number-one hit in the United States as a solo artist, and his only chart-topping single in either the US or Britain during his lifetime.\n\nQ: Nobody Loves You was written by John Lennon and released on what album that was issued by Apple Records, and was written, recorded, and released during his 18 month separation from Yoko Ono?\nA: The album issued by Apple Records, and written, recorded, and released during John Lennon's 18 month separation from Yoko Ono is Walls and Bridges. Nobody Loves You was written by John Lennon on Walls and Bridges album. So the answer is: Walls and Bridges.\n\n\nWikipedia Title: Route 13 (Laos)\nRoute 13 is the most important highway in the country of Laos. It begins at Boten in the North of Laos at the Chinese border. It connects the city of Vientiane to Luang Prabang in the north and roughly follows the line of the Mekong River down to the border with Cambodia. The road then continues at National Highway 7 in Cambodia. Also this national highway leads past all three international airports in Laos Vientiane Airport, Luang Prabang Airport and Pakse Airport. Between Boten and Nateuy the Route 13 is at a length of 20 km part of the Kunming-Bangkok Expressway, which is also part of the Asian Highway AH3. From Nateuy to Vientiane, the Route 13 is part of the AH12 and from Vientiane to the border of Cambodia AH11.\n\nWikipedia Title: National Route 13 (Vietnam)\nNational Route 13 (Vietnamese: \"Quốc lộ 13\" ) is a highway in southern Vietnam stretching from the northeastern outskirts of Ho Chi Minh City, the commercial centre of the country, towards the border to Cambodia. The highway starts around Thủ Đức on the northern outskirts of Ho Chi Minh City, once the site of the military academy of the Army of the Republic of Vietnam, and travels north through the provinces of Bình Dương and Bình Phước. The highway passes through the districts of Thuận An, Thủ Dầu Một town, Bến Cát, Chơn Thành, Đồng Phú, Bình Long, and Lộc Ninh.\n\nWikipedia Title: Glen Osmond, South Australia\nGlen Osmond is a suburb of Adelaide, South Australia in the City of Burnside which is in the foothills of the Adelaide Hills. It is well known for the road intersection on the western side of the suburb, where the South Eastern Freeway (National Route M1) from the Adelaide Hills and the main route from Melbourne splits into National Route A17 Portrush Road (north, the main route towards Port Adelaide), Glen Osmond Road, Adelaide (northwest towards Adelaide city centre) and state route A3 Cross Road west towards the coast and southern suburbs.\n\nWikipedia Title: Cambodia\nCambodia ( ; Khmer: កម្ពុជា , or Kampuchea ] ), officially known as the Kingdom of Cambodia (Khmer: ព្រះរាជាណាចក្រកម្ពុជា , \"Preăh Réachéanachâk Kâmpŭchéa\", ] ), is a country located in the southern portion of the Indochina Peninsula in Southeast Asia. It is 181035 km2 in area, bordered by Thailand to the northwest, Laos to the northeast, Vietnam to the east, and the Gulf of Thailand to the southwest.\n\nQ: What is known as the Kingdom and has National Route 13 stretching towards its border?\nA: Cambodia is officially known as the Kingdom of Cambodia. National Route 13 streches towards border to Cambodia. So the answer is: Cambodia.\n\n\nWikipedia Title: James Draper (settler)\nJames Draper (1618–1694) was an early settler of the Massachusetts Bay Colony. He was born and married in Heptonstall, Yorkshire, England, and came with his wife to New England shortly after 1647. He was a weaver by profession, and settled in the Massachusetts town of Roxbury, but also lived for a short while in the towns of Dedham and Charlestown. He and his wife had nine children and many notable descendants. They are buried in the Westerly Burial Ground in West Roxbury, now a neighborhood of Boston, and share the oldest marker in the cemetery.\n\nWikipedia Title: Jeremy Theobald\nJeremy Theobald is a British actor best known for his portrayal of \"The Young Man\", the main character in Christopher Nolan's 1998 major picture debut \"Following\", and for which Theobald was also a producer, Filming was scheduled around their day jobs. Jonathan Romney, writing in the \"New Statesman\", noted that \"Nolan and his cast are terrific finds: I wouldn't normally say this to struggling artists, but they might want to give up their day jobs.\"\n\nWikipedia Title: Christopher Nolan\nChristopher Edward Nolan ( ; born 30 July 1970) is an English-American film director, producer, and screenwriter. He is one of the highest-grossing directors in history, and among the most successful and acclaimed filmmakers of the 21st century.\n\nWikipedia Title: Semper Gestion\nSemper is a Swiss wealth management company, asset management and Family Office established in 2001 and working in open architecture. Based in Geneva, with a team of highly skilled portfolio managers who share a common vision of the profession, its model and its values, Semper has a sister company in London (Beauregard Capital Limited) and a representative office in Shanghai (Shanghai Semper). Since 2001, she offers a highly personalized service of wealth management and Family Office. Managed by Grégoire Vaucher (CEO) and Jean-Evrard Dominicé (CIO), Semper currently has 20 employees.\n\nQ: Jeremy Theobald and Christopher Nolan share what profession?\nA: Jeremy Theobald is an actor and producer. Christopher Nolan is a director, producer, and screenwriter. Therefore, they both share the profession of being a producer. So the answer is: producer.\n\n\nWikipedia Title: passage title: Kanichee Mine\npassage title: Kanichee Mine\nThe Kanichee Mine, also less commonly known as the Ajax Mine, is an abandoned base metal and precious metal mine, located in the Temagami region of northeastern Ontario, Canada.  It is near the small unincorporated community of Temagami North, accessed by the Kanichee Mine Road from Highway 11.  The Kanichee Mine zone has been explored and mined discontinuously from as early as 1910.  During the 20th century, it operated and closed down at least three times, with the most recent being from 1973 to 1976.  To date, the discontinuous operation of Kanichee Mine has produced 4.2 million pounds of metal.\n\nWikipedia Title: passage title: Salmita Mine\npassage title: Salmita Mine\nThe Salmita Mine was a gold producer in the Northwest Territories, Canada during 1983 to 1987.  The deposit was first discovered in 1945 and underground exploration was carried out in 1951-1952.  It was reactivated for exploration by Giant Yellowknife Mines Limited in 1975 and entered production in 1983.  They used the old camp and milling plant of the abandoned Tundra Mine, located a few kilometres to the south.  The mine produced 179,906 troy ounces (5596 kg) of gold from the milling of 238,177 tons of ore.\n\nWikipedia Title: passage title: Nova Lima\npassage title: Nova Lima\nNova Lima is a municipality of about 87,000 people, whose downtown is located about 20 kilometers of Belo Horizonte, the capital of the south-eastern Brazilian state of Minas Gerais.  Mining is one of the main economical activities of the city, including the extraction of Iron Ore and Gold.  The most famous mine in the city is Morro Velho (Old Hill), a gold mine of 2700 m depth.\n\nWikipedia Title: passage title: San Manuel Copper Mine\npassage title: San Manuel Copper Mine\nThe San Manuel Copper Mine was a surface and underground porphyry copper mine located in San Manuel, Pinal County, Arizona.  Frank Schultz was the original discoverer, in 1879, but the main body of the deposits were discovered by Henry W. Nichols in 1942.  The exploration drilling went on from 1943 to 1948, with the first mine shaft built 1948.  Louis Lesser developed a mining city to service Nichols’ newly discovered deposits, and the development was completed about 1954.  The first major production began in 1955, and the mine and smelter were permanently closed in 2003.\n\nWikipedia Title: passage title: Mao-4 moored mine\npassage title: Mao-4 moored mine\nMoored-4 (锚-4, Mao-4) moored mine developed by Fengxi Machinery Factory (汾西机器厂) was accepted into service in November 1973, and it is the first moored mine in the Chinese service that incorporates acoustic fuse.  The mine can be planted by both the surface ships and submarines from depth of 20–200 meters, and it weighs 600 kg.  The mine has an effective radius of 20 meters and effective life of 2 years.  The original Moored-4 was upgraded to Moored-4-I (锚-4甲, Mao-4-Jia) standard in November 1982, and subsequently upgraded into Moored-4-II (锚-4乙, Mao-4-Yi) standard by December 1985.  In comparison to earlier versions, the latest version adopted large scale integrated circuits.\n\nWikipedia Title: passage title: Burra Burra Mine (Tennessee)\npassage title: Burra Burra Mine (Tennessee)\nThe Burra Burra Mine is a copper mine located in Ducktown, Tennessee, in the southeastern United States.  Named for the famous mine in Australia, the Burra Burra Mine extracted over 15 million tons (14 million metric tons) of copper ore during its 60 years of operation between 1899 and 1959.  The mine's remaining structures are listed on the National Register of Historic Places as part of the Burra Burra Mine Historic District.  The site is also home to the Ducktown Basin Museum, and the museum and mine are a Tennessee State Historic Site operated in partnership with the Tennessee Historical Commission.\n\nQ: Which famous mine was in service first, the Salmita Mine or the Kanichee Mine?\nA: The Kanichee Mine was in operation from as early as 1910, while the Salmita Mine was first discovered in 1945 and entered production in 1983.", "model_response": "The Kanichee Mine was in operation from as early as 1910, while the Salmita Mine was first discovered in 1945 and entered production in 1983.", "total_input_tokens": 13905, "total_output_tokens": 202, "total_tokens": 14107, "total_time_consumed": 2.0398950576782227, "step_stats": [{"iteration": 1, "type": "reasoning", "input_tokens": 2625, "output_tokens": 50}, {"iteration": 2, "type": "reasoning", "input_tokens": 2820, "output_tokens": 38}, {"iteration": 3, "type": "reasoning", "input_tokens": 2820, "output_tokens": 38}, {"iteration": 4, "type": "reasoning", "input_tokens": 2820, "output_tokens": 38}, {"iteration": 5, "type": "reasoning", "input_tokens": 2820, "output_tokens": 38}]}
{"question": "What occupation did Nicholas Christopher and Roger Ebert share?", "gold_answer": "author", "pred_answer": "The answers are:\n\n1. Walls and Bridges\n2. Cambodia\n3. producer\n4. film critic", "is_correct": false, "collected_titles": ["passage title: Nicholas Christopher", "passage title: Roger Ebert", "passage title: RogerEbert.com", "passage title: Ebertfest: Roger Ebert's Film Festival", "passage title: Ebert Presents: At the Movies", "passage title: At the Movies (U.S. TV series)", "passage title: The Krypton Factor", "passage title: Eat to Live", "passage title: Waltzing Matilda", "passage title: Poleconomy", "passage title: Karaoke Star Jr."], "collected_passages": ["passage title: Nicholas Christopher\nNicholas Christopher (born 1951) is an American novelist, poet and critic, the author of sixteen books: six novels, eight volumes of poetry, a critical study of film noir, and a novel for children.", "passage title: Roger Ebert\nRoger Joseph Ebert ( ; June 18, 1942 – April 4, 2013) was an American film critic and historian, journalist, screenwriter, and author.  He was a film critic for the \"Chicago Sun-Times\" from 1967 until his death in 2013.  In 1975, Ebert became the first film critic to win the Pulitzer Prize for Criticism.", "passage title: RogerEbert.com\nRogerEbert.com is a film review website that archives film critic Roger Ebert's reviews for the \"Chicago Sun-Times\" and also shares other critics' reviews and essays.  Ebert handpicked writers from around the world to contribute to the website.  After Ebert died in 2013, the website was relaunched under Ebert Digital, a partnership between Ebert, his wife Chaz, and friend Josh Golden, begun while Ebert was still alive.", "passage title: Ebertfest: Roger Ebert's Film Festival\nRoger Ebert's Film Festival, originally known as Roger Ebert's Overlooked Film Festival but commonly referred to as simply Ebertfest, is an annual film festival held every April in Champaign, Illinois, United States, organized by the College of Media at the University of Illinois.  Roger Ebert, the TV and \"Chicago Sun-Times\" film critic, was a native of the adjoining town of Urbana, Illinois and is an alumnus of the University.  Founded in 1999, this event is the only long-running film festival created by a critic.  Despite Ebert’s death in 2013, the festival continues to operate based on Ebert’s notes and vision for the kinds of films he championed.", "passage title: Ebert Presents: At the Movies\nEbert Presents: At the Movies was a weekly, nationally syndicated movie review television program produced and presented by film critic Roger Ebert and co-produced by his wife, Chaz Ebert.  The program aired on public television stations in the United States through American Public Television.", "passage title: At the Movies (U.S. TV series)\nAt the Movies (originally Siskel & Ebert & the Movies, and later At the Movies with Ebert and Roeper) is a movie review television program produced by Disney-ABC Domestic Television in which two film critics share their opinions of newly released films.  Its original hosts were Roger Ebert and Gene Siskel, the former hosts of \"Sneak Previews\" on PBS (1975–1982) and a similarly-titled syndicated series (1982–1986).  Following Siskel's death in 1999, Ebert worked with various guest critics until choosing \"Chicago Sun-Times\" colleague Richard Roeper as his regular partner in 2000.", "passage title: The Krypton Factor\nThe Krypton Factor is a British game show produced by Granada for broadcast on ITV.  The show originally ran from 7 September 1977 to 20 November 1995, and was hosted by Gordon Burns and usually broadcast on the ITV network on Mondays at 7pm.", "passage title: Eat to Live\nEat to Live: The Amazing Nutrient-Rich Program for Fast and Sustained Weight Loss is a book written in 2003 by Dr. Joel Fuhrman, which he revised in 2011.  The book offers a formula: health = nutrients / calories.", "passage title: Waltzing Matilda\n\"Waltzing Matilda\" is Australia's best-known bush ballad, and has been described as the country's \"unofficial national anthem\".", "passage title: Poleconomy\nPoleconomy is a board game invented by New Zealander Bruce E. Hatherley and first published in 1980.  It is similar to \"Monopoly\" but the board is divided into companies rather than properties.  Players compete to acquire properties and investments through stylized economic and political activity.  The playing time is set by agreement from all players, e.g. 2 hours, and the winner is determined by the monetary sum of all player cash, companies, insurance or other assets.  The game can also end when there are no more companies, advertisements in the bank or bonds in the treasury.  Another objective of the game is \"to teach players some of the fundamentals of economics, and the ways in which the economy and the government interact.\"  Different editions were published for several different countries.  The name \"Poleconomy\" is a portmanteau of \"politics\" and \"economy\".", "passage title: Karaoke Star Jr.\nKaraoke Star Jr. is a reality television show for children that airs on YTV and CMT.  This show is just like the show Karaoke Star, except it features kids instead of adults.  It is hosted by Paul McGuire (CMT) and Phil Guerrero (YTV).  The purpose of the show is to discover Canada's first ever Karaoke Star Jr.  The show premiered on YTV and CMT on March 16, 2009 at 7pm ET.  New episodes of the show now air every Monday on these stations.  Jamiee is the winner from the first season."], "generated_sentences": ["Nicholas Christopher and Roger Ebert shared the occupation of a film critic.", "The answers are:\n\n1.", "1. Nicholas Christopher and Roger Ebert shared the occupation of a film critic."], "model_input": "Wikipedia Title: Nobody Loves You (When You're Down and Out)\n\"Nobody Loves You (When You're Down and Out)\" is a song written by John Lennon released on his 1974 album \"Walls and Bridges\". The song is included on the 1986 compilation \"Menlove Ave.\", the 1990 boxset \"Lennon\", the 1998 boxset \"John Lennon Anthology\", the 2005 two-disc compilation \"\", and the 2010 boxset \"Gimme Some Truth\".\n\nWikipedia Title: John Lennon/Plastic Ono Band\nJohn Lennon/Plastic Ono Band is the debut studio album by English rock musician John Lennon. It was released in 1970, after Lennon had issued three experimental albums with Yoko Ono and \"Live Peace in Toronto 1969\", a live performance in Toronto credited to the Plastic Ono Band. The album was recorded simultaneously with Ono's debut avant garde solo album, \"Yoko Ono/Plastic Ono Band\", at Ascot Sound Studios and Abbey Road Studios using the same musicians and production team and nearly identical cover artwork.\n\nWikipedia Title: Mother (John Lennon song)\n\"Mother\" is a song by English musician John Lennon, first released on his 1970 album \"John Lennon/Plastic Ono Band\". An edited version of the song was issued as a single in the United States on Apple Records, on 28 December 1970. The single runs about 1:41 shorter than the album due to a lack of the tolling bells intro and a quicker fadeout. The B-side features \"Why\" by Yoko Ono. The song peaked in the US at number 19 on the \"Cashbox\" Top 100 and number 43 on the \"Billboard\" Hot 100.\n\nWikipedia Title: Walls and Bridges\nWalls and Bridges is the fifth studio album by English musician John Lennon. It was issued by Apple Records on 26 September 1974 in the United States and on 4 October in the United Kingdom. Written, recorded and released during his 18-month separation from Yoko Ono, the album captured Lennon in the midst of his \"Lost Weekend\". \"Walls and Bridges\" was an American \"Billboard\" number-one album and featured two hit singles, \"Whatever Gets You thru the Night\" and \"#9 Dream\". The first of these was Lennon's first number-one hit in the United States as a solo artist, and his only chart-topping single in either the US or Britain during his lifetime.\n\nQ: Nobody Loves You was written by John Lennon and released on what album that was issued by Apple Records, and was written, recorded, and released during his 18 month separation from Yoko Ono?\nA: The album issued by Apple Records, and written, recorded, and released during John Lennon's 18 month separation from Yoko Ono is Walls and Bridges. Nobody Loves You was written by John Lennon on Walls and Bridges album. So the answer is: Walls and Bridges.\n\n\nWikipedia Title: Route 13 (Laos)\nRoute 13 is the most important highway in the country of Laos. It begins at Boten in the North of Laos at the Chinese border. It connects the city of Vientiane to Luang Prabang in the north and roughly follows the line of the Mekong River down to the border with Cambodia. The road then continues at National Highway 7 in Cambodia. Also this national highway leads past all three international airports in Laos Vientiane Airport, Luang Prabang Airport and Pakse Airport. Between Boten and Nateuy the Route 13 is at a length of 20 km part of the Kunming-Bangkok Expressway, which is also part of the Asian Highway AH3. From Nateuy to Vientiane, the Route 13 is part of the AH12 and from Vientiane to the border of Cambodia AH11.\n\nWikipedia Title: National Route 13 (Vietnam)\nNational Route 13 (Vietnamese: \"Quốc lộ 13\" ) is a highway in southern Vietnam stretching from the northeastern outskirts of Ho Chi Minh City, the commercial centre of the country, towards the border to Cambodia. The highway starts around Thủ Đức on the northern outskirts of Ho Chi Minh City, once the site of the military academy of the Army of the Republic of Vietnam, and travels north through the provinces of Bình Dương and Bình Phước. The highway passes through the districts of Thuận An, Thủ Dầu Một town, Bến Cát, Chơn Thành, Đồng Phú, Bình Long, and Lộc Ninh.\n\nWikipedia Title: Glen Osmond, South Australia\nGlen Osmond is a suburb of Adelaide, South Australia in the City of Burnside which is in the foothills of the Adelaide Hills. It is well known for the road intersection on the western side of the suburb, where the South Eastern Freeway (National Route M1) from the Adelaide Hills and the main route from Melbourne splits into National Route A17 Portrush Road (north, the main route towards Port Adelaide), Glen Osmond Road, Adelaide (northwest towards Adelaide city centre) and state route A3 Cross Road west towards the coast and southern suburbs.\n\nWikipedia Title: Cambodia\nCambodia ( ; Khmer: កម្ពុជា , or Kampuchea ] ), officially known as the Kingdom of Cambodia (Khmer: ព្រះរាជាណាចក្រកម្ពុជា , \"Preăh Réachéanachâk Kâmpŭchéa\", ] ), is a country located in the southern portion of the Indochina Peninsula in Southeast Asia. It is 181035 km2 in area, bordered by Thailand to the northwest, Laos to the northeast, Vietnam to the east, and the Gulf of Thailand to the southwest.\n\nQ: What is known as the Kingdom and has National Route 13 stretching towards its border?\nA: Cambodia is officially known as the Kingdom of Cambodia. National Route 13 streches towards border to Cambodia. So the answer is: Cambodia.\n\n\nWikipedia Title: James Draper (settler)\nJames Draper (1618–1694) was an early settler of the Massachusetts Bay Colony. He was born and married in Heptonstall, Yorkshire, England, and came with his wife to New England shortly after 1647. He was a weaver by profession, and settled in the Massachusetts town of Roxbury, but also lived for a short while in the towns of Dedham and Charlestown. He and his wife had nine children and many notable descendants. They are buried in the Westerly Burial Ground in West Roxbury, now a neighborhood of Boston, and share the oldest marker in the cemetery.\n\nWikipedia Title: Jeremy Theobald\nJeremy Theobald is a British actor best known for his portrayal of \"The Young Man\", the main character in Christopher Nolan's 1998 major picture debut \"Following\", and for which Theobald was also a producer, Filming was scheduled around their day jobs. Jonathan Romney, writing in the \"New Statesman\", noted that \"Nolan and his cast are terrific finds: I wouldn't normally say this to struggling artists, but they might want to give up their day jobs.\"\n\nWikipedia Title: Christopher Nolan\nChristopher Edward Nolan ( ; born 30 July 1970) is an English-American film director, producer, and screenwriter. He is one of the highest-grossing directors in history, and among the most successful and acclaimed filmmakers of the 21st century.\n\nWikipedia Title: Semper Gestion\nSemper is a Swiss wealth management company, asset management and Family Office established in 2001 and working in open architecture. Based in Geneva, with a team of highly skilled portfolio managers who share a common vision of the profession, its model and its values, Semper has a sister company in London (Beauregard Capital Limited) and a representative office in Shanghai (Shanghai Semper). Since 2001, she offers a highly personalized service of wealth management and Family Office. Managed by Grégoire Vaucher (CEO) and Jean-Evrard Dominicé (CIO), Semper currently has 20 employees.\n\nQ: Jeremy Theobald and Christopher Nolan share what profession?\nA: Jeremy Theobald is an actor and producer. Christopher Nolan is a director, producer, and screenwriter. Therefore, they both share the profession of being a producer. So the answer is: producer.\n\n\nWikipedia Title: passage title: Nicholas Christopher\npassage title: Nicholas Christopher\nNicholas Christopher (born 1951) is an American novelist, poet and critic, the author of sixteen books: six novels, eight volumes of poetry, a critical study of film noir, and a novel for children.\n\nWikipedia Title: passage title: Roger Ebert\npassage title: Roger Ebert\nRoger Joseph Ebert ( ; June 18, 1942 – April 4, 2013) was an American film critic and historian, journalist, screenwriter, and author.  He was a film critic for the \"Chicago Sun-Times\" from 1967 until his death in 2013.  In 1975, Ebert became the first film critic to win the Pulitzer Prize for Criticism.\n\nWikipedia Title: passage title: RogerEbert.com\npassage title: RogerEbert.com\nRogerEbert.com is a film review website that archives film critic Roger Ebert's reviews for the \"Chicago Sun-Times\" and also shares other critics' reviews and essays.  Ebert handpicked writers from around the world to contribute to the website.  After Ebert died in 2013, the website was relaunched under Ebert Digital, a partnership between Ebert, his wife Chaz, and friend Josh Golden, begun while Ebert was still alive.\n\nWikipedia Title: passage title: Ebertfest: Roger Ebert's Film Festival\npassage title: Ebertfest: Roger Ebert's Film Festival\nRoger Ebert's Film Festival, originally known as Roger Ebert's Overlooked Film Festival but commonly referred to as simply Ebertfest, is an annual film festival held every April in Champaign, Illinois, United States, organized by the College of Media at the University of Illinois.  Roger Ebert, the TV and \"Chicago Sun-Times\" film critic, was a native of the adjoining town of Urbana, Illinois and is an alumnus of the University.  Founded in 1999, this event is the only long-running film festival created by a critic.  Despite Ebert’s death in 2013, the festival continues to operate based on Ebert’s notes and vision for the kinds of films he championed.\n\nWikipedia Title: passage title: Ebert Presents: At the Movies\npassage title: Ebert Presents: At the Movies\nEbert Presents: At the Movies was a weekly, nationally syndicated movie review television program produced and presented by film critic Roger Ebert and co-produced by his wife, Chaz Ebert.  The program aired on public television stations in the United States through American Public Television.\n\nWikipedia Title: passage title: At the Movies (U.S. TV series)\npassage title: At the Movies (U.S. TV series)\nAt the Movies (originally Siskel & Ebert & the Movies, and later At the Movies with Ebert and Roeper) is a movie review television program produced by Disney-ABC Domestic Television in which two film critics share their opinions of newly released films.  Its original hosts were Roger Ebert and Gene Siskel, the former hosts of \"Sneak Previews\" on PBS (1975–1982) and a similarly-titled syndicated series (1982–1986).  Following Siskel's death in 1999, Ebert worked with various guest critics until choosing \"Chicago Sun-Times\" colleague Richard Roeper as his regular partner in 2000.\n\nWikipedia Title: passage title: The Krypton Factor\npassage title: The Krypton Factor\nThe Krypton Factor is a British game show produced by Granada for broadcast on ITV.  The show originally ran from 7 September 1977 to 20 November 1995, and was hosted by Gordon Burns and usually broadcast on the ITV network on Mondays at 7pm.\n\nWikipedia Title: passage title: Eat to Live\npassage title: Eat to Live\nEat to Live: The Amazing Nutrient-Rich Program for Fast and Sustained Weight Loss is a book written in 2003 by Dr. Joel Fuhrman, which he revised in 2011.  The book offers a formula: health = nutrients / calories.\n\nWikipedia Title: passage title: Waltzing Matilda\npassage title: Waltzing Matilda\n\"Waltzing Matilda\" is Australia's best-known bush ballad, and has been described as the country's \"unofficial national anthem\".\n\nWikipedia Title: passage title: Poleconomy\npassage title: Poleconomy\nPoleconomy is a board game invented by New Zealander Bruce E. Hatherley and first published in 1980.  It is similar to \"Monopoly\" but the board is divided into companies rather than properties.  Players compete to acquire properties and investments through stylized economic and political activity.  The playing time is set by agreement from all players, e.g. 2 hours, and the winner is determined by the monetary sum of all player cash, companies, insurance or other assets.  The game can also end when there are no more companies, advertisements in the bank or bonds in the treasury.  Another objective of the game is \"to teach players some of the fundamentals of economics, and the ways in which the economy and the government interact.\"  Different editions were published for several different countries.  The name \"Poleconomy\" is a portmanteau of \"politics\" and \"economy\".\n\nWikipedia Title: passage title: Karaoke Star Jr.\npassage title: Karaoke Star Jr.\nKaraoke Star Jr. is a reality television show for children that airs on YTV and CMT.  This show is just like the show Karaoke Star, except it features kids instead of adults.  It is hosted by Paul McGuire (CMT) and Phil Guerrero (YTV).  The purpose of the show is to discover Canada's first ever Karaoke Star Jr.  The show premiered on YTV and CMT on March 16, 2009 at 7pm ET.  New episodes of the show now air every Monday on these stations.  Jamiee is the winner from the first season.\n\nQ: What occupation did Nicholas Christopher and Roger Ebert share?\nA: Nicholas Christopher and Roger Ebert shared the occupation of a film critic. The answers are:\n\n1. 1. Nicholas Christopher and Roger Ebert shared the occupation of a film critic.", "model_response": "The answers are:\n\n1. Walls and Bridges\n2. Cambodia\n3. producer\n4. film critic", "total_input_tokens": 14366, "total_output_tokens": 102, "total_tokens": 14468, "total_time_consumed": 1.2086565494537354, "step_stats": [{"iteration": 1, "type": "reasoning", "input_tokens": 2377, "output_tokens": 16}, {"iteration": 2, "type": "reasoning", "input_tokens": 2565, "output_tokens": 23}, {"iteration": 3, "type": "reasoning", "input_tokens": 3130, "output_tokens": 17}, {"iteration": 4, "type": "reasoning", "input_tokens": 3147, "output_tokens": 23}, {"iteration": 5, "type": "reasoning", "input_tokens": 3147, "output_tokens": 23}]}
